TVM/tvm-log/2080Ti/gpu/onnx/1batch/gpu_onnx_1batch_resnet34_v2.log
{"i": ["cuda -model=unknown", "topi_nn_conv2d", [["TENSOR", [1, 256, 14, 14], "float32"], ["TENSOR", [512, 256, 1, 1], "float32"], [2, 2], [0, 0], [1, 1], "NCHW", "float32"], {}, ["conv2d", [1, 256, 14, 14, "float32"], [512, 256, 1, 1, "float32"], [2, 2], [0, 0], [1, 1], "NCHW", "float32"], {"i": 107440, "t": "direct", "c": null, "e": [["tile_f", "sp", [-1, 2, 8, 2]], ["tile_y", "sp", [-1, 1, 1, 1]], ["tile_x", "sp", [-1, 1, 7, 1]], ["tile_rc", "sp", [-1, 8]], ["tile_ry", "sp", [-1, 1]], ["tile_rx", "sp", [-1, 1]], ["auto_unroll_max_step", "ot", 0], ["unroll_explicit", "ot", 1]]}], "r": [[1.648068826182935e-05], 0, 40.5947687625885, 1596709198.341779], "v": 0.1}
{"i": ["cuda -model=unknown", "topi_nn_conv2d", [["TENSOR", [1, 128, 28, 28], "float32"], ["TENSOR", [256, 128, 1, 1], "float32"], [2, 2], [0, 0], [1, 1], "NCHW", "float32"], {}, ["conv2d", [1, 128, 28, 28, "float32"], [256, 128, 1, 1, "float32"], [2, 2], [0, 0], [1, 1], "NCHW", "float32"], {"i": 1499587, "t": "direct", "c": null, "e": [["tile_f", "sp", [-1, 2, 8, 2]], ["tile_y", "sp", [-1, 1, 1, 1]], ["tile_x", "sp", [-1, 1, 14, 1]], ["tile_rc", "sp", [-1, 8]], ["tile_ry", "sp", [-1, 1]], ["tile_rx", "sp", [-1, 1]], ["auto_unroll_max_step", "ot", 512], ["unroll_explicit", "ot", 1]]}], "r": [[1.029175480710349e-05], 0, 10.68094515800476, 1596710086.8041778], "v": 0.1}
{"i": ["cuda -model=unknown", "topi_nn_conv2d", [["TENSOR", [1, 64, 56, 56], "float32"], ["TENSOR", [128, 64, 1, 1], "float32"], [2, 2], [0, 0], [1, 1], "NCHW", "float32"], {}, ["conv2d", [1, 64, 56, 56, "float32"], [128, 64, 1, 1, "float32"], [2, 2], [0, 0], [1, 1], "NCHW", "float32"], {"i": 4465262, "t": "direct", "c": null, "e": [["tile_f", "sp", [-1, 2, 32, 2]], ["tile_y", "sp", [-1, 1, 4, 1]], ["tile_x", "sp", [-1, 1, 4, 1]], ["tile_rc", "sp", [-1, 4]], ["tile_ry", "sp", [-1, 1]], ["tile_rx", "sp", [-1, 1]], ["auto_unroll_max_step", "ot", 0], ["unroll_explicit", "ot", 1]]}], "r": [[1.1622677390465694e-05], 0, 26.281941890716553, 1596710631.2994287], "v": 0.1}
{"i": ["cuda -model=unknown", "topi_nn_conv2d", [["TENSOR", [1, 3, 224, 224], "float32"], ["TENSOR", [64, 3, 7, 7], "float32"], [2, 2], [3, 3], [1, 1], "NCHW", "float32"], {}, ["conv2d", [1, 3, 224, 224, "float32"], [64, 3, 7, 7, "float32"], [2, 2], [3, 3], [1, 1], "NCHW", "float32"], {"i": 76523372, "t": "direct", "c": null, "e": [["tile_f", "sp", [-1, 2, 8, 2]], ["tile_y", "sp", [-1, 4, 2, 1]], ["tile_x", "sp", [-1, 1, 8, 2]], ["tile_rc", "sp", [-1, 1]], ["tile_ry", "sp", [-1, 7]], ["tile_rx", "sp", [-1, 7]], ["auto_unroll_max_step", "ot", 1500], ["unroll_explicit", "ot", 1]]}], "r": [[3.429050401881984e-05], 0, 13.591188192367554, 1596711654.6333613], "v": 0.1}
{"i": ["cuda -model=unknown", "topi_nn_conv2d", [["TENSOR", [1, 64, 56, 56], "float32"], ["TENSOR", [64, 64, 3, 3], "float32"], [1, 1], [1, 1], [1, 1], "NCHW", "float32"], {}, ["conv2d", [1, 64, 56, 56, "float32"], [64, 64, 3, 3, "float32"], [1, 1], [1, 1], [1, 1], "NCHW", "float32"], {"i": 331789, "t": "winograd", "c": null, "e": [["tile_b", "sp", [-1, 1, 1, 1]], ["tile_y", "sp", [-1, 1, 8, 8]], ["tile_x", "sp", [-1, 1, 14, 2]], ["tile_rc", "sp", [-1, 16]], ["auto_unroll_max_step", "ot", 1500], ["unroll_explicit", "ot", 1]]}], "r": [[2.0532319257540603e-05], 0, 64.18582272529602, 1596712608.5314767], "v": 0.1}
{"i": ["cuda -model=unknown", "topi_nn_conv2d", [["TENSOR", [1, 64, 56, 56], "float32"], ["TENSOR", [128, 64, 3, 3], "float32"], [2, 2], [1, 1], [1, 1], "NCHW", "float32"], {}, ["conv2d", [1, 64, 56, 56, "float32"], [128, 64, 3, 3, "float32"], [2, 2], [1, 1], [1, 1], "NCHW", "float32"], {"i": 31560143, "t": "direct", "c": null, "e": [["tile_f", "sp", [-1, 4, 8, 1]], ["tile_y", "sp", [-1, 2, 1, 1]], ["tile_x", "sp", [-1, 1, 14, 1]], ["tile_rc", "sp", [-1, 8]], ["tile_ry", "sp", [-1, 3]], ["tile_rx", "sp", [-1, 3]], ["auto_unroll_max_step", "ot", 1500], ["unroll_explicit", "ot", 1]]}], "r": [[4.5227564938398355e-05], 0, 37.99890208244324, 1596713297.0977006], "v": 0.1}
{"i": ["cuda -model=unknown", "topi_nn_conv2d", [["TENSOR", [1, 128, 28, 28], "float32"], ["TENSOR", [128, 128, 3, 3], "float32"], [1, 1], [1, 1], [1, 1], "NCHW", "float32"], {}, ["conv2d", [1, 128, 28, 28, "float32"], [128, 128, 3, 3, "float32"], [1, 1], [1, 1], [1, 1], "NCHW", "float32"], {"i": 438464, "t": "winograd", "c": null, "e": [["tile_b", "sp", [-1, 1, 1, 1]], ["tile_y", "sp", [-1, 1, 2, 16]], ["tile_x", "sp", [-1, 1, 98, 2]], ["tile_rc", "sp", [-1, 16]], ["auto_unroll_max_step", "ot", 128], ["unroll_explicit", "ot", 1]]}], "r": [[2.302577777777778e-05], 0, 7.24981427192688, 1596713762.7258377], "v": 0.1}
{"i": ["cuda -model=unknown", "topi_nn_conv2d", [["TENSOR", [1, 128, 28, 28], "float32"], ["TENSOR", [256, 128, 3, 3], "float32"], [2, 2], [1, 1], [1, 1], "NCHW", "float32"], {}, ["conv2d", [1, 128, 28, 28, "float32"], [256, 128, 3, 3, "float32"], [2, 2], [1, 1], [1, 1], "NCHW", "float32"], {"i": 7928606, "t": "direct", "c": null, "e": [["tile_f", "sp", [-1, 4, 8, 1]], ["tile_y", "sp", [-1, 1, 2, 1]], ["tile_x", "sp", [-1, 1, 7, 2]], ["tile_rc", "sp", [-1, 8]], ["tile_ry", "sp", [-1, 3]], ["tile_rx", "sp", [-1, 3]], ["auto_unroll_max_step", "ot", 1500], ["unroll_explicit", "ot", 1]]}], "r": [[4.95709782239819e-05], 0, 6.458728075027466, 1596714271.6588795], "v": 0.1}
{"i": ["cuda -model=unknown", "topi_nn_conv2d", [["TENSOR", [1, 256, 14, 14], "float32"], ["TENSOR", [256, 256, 3, 3], "float32"], [1, 1], [1, 1], [1, 1], "NCHW", "float32"], {}, ["conv2d", [1, 256, 14, 14, "float32"], [256, 256, 3, 3, "float32"], [1, 1], [1, 1], [1, 1], "NCHW", "float32"], {"i": 66763, "t": "winograd", "c": null, "e": [["tile_b", "sp", [-1, 1, 1, 1]], ["tile_y", "sp", [-1, 1, 16, 4]], ["tile_x", "sp", [-1, 7, 7, 1]], ["tile_rc", "sp", [-1, 16]], ["auto_unroll_max_step", "ot", 128], ["unroll_explicit", "ot", 1]]}], "r": [[2.9593216628402756e-05], 0, 8.749295711517334, 1596715251.4621148], "v": 0.1}
{"i": ["cuda -model=unknown", "topi_nn_conv2d", [["TENSOR", [1, 256, 14, 14], "float32"], ["TENSOR", [512, 256, 3, 3], "float32"], [2, 2], [1, 1], [1, 1], "NCHW", "float32"], {}, ["conv2d", [1, 256, 14, 14, "float32"], [512, 256, 3, 3, "float32"], [2, 2], [1, 1], [1, 1], "NCHW", "float32"], {"i": 744941, "t": "direct", "c": null, "e": [["tile_f", "sp", [-1, 4, 4, 1]], ["tile_y", "sp", [-1, 1, 7, 1]], ["tile_x", "sp", [-1, 1, 7, 1]], ["tile_rc", "sp", [-1, 16]], ["tile_ry", "sp", [-1, 3]], ["tile_rx", "sp", [-1, 3]], ["auto_unroll_max_step", "ot", 1500], ["unroll_explicit", "ot", 1]]}], "r": [[7.766273407079646e-05], 0, 75.52114152908325, 1596715712.5330307], "v": 0.1}
{"i": ["cuda -model=unknown", "topi_nn_conv2d", [["TENSOR", [1, 512, 7, 7], "float32"], ["TENSOR", [512, 512, 3, 3], "float32"], [1, 1], [1, 1], [1, 1], "NCHW", "float32"], {}, ["conv2d", [1, 512, 7, 7, "float32"], [512, 512, 3, 3, "float32"], [1, 1], [1, 1], [1, 1], "NCHW", "float32"], {"i": 41446, "t": "winograd", "c": null, "e": [["tile_b", "sp", [-1, 1, 1, 1]], ["tile_y", "sp", [-1, 2, 16, 2]], ["tile_x", "sp", [-1, 2, 8, 1]], ["tile_rc", "sp", [-1, 32]], ["auto_unroll_max_step", "ot", 0], ["unroll_explicit", "ot", 0]]}], "r": [[4.212214270056992e-05], 0, 77.60462164878845, 1596716668.6408932], "v": 0.1}
