TVM/tvm-log/V100/gpu/onnx/1batch/gpu_onnx_1batch_mobilenet0.25.log
{"i": ["cuda -model=unknown", "topi_nn_conv2d", [["TENSOR", [1, 3, 224, 224], "float32"], ["TENSOR", [8, 3, 3, 3], "float32"], [2, 2], [1, 1], [1, 1], "NCHW", "float32"], {}, ["conv2d", [1, 3, 224, 224, "float32"], [8, 3, 3, 3, "float32"], [2, 2], [1, 1], [1, 1], "NCHW", "float32"], {"i": 11844029, "t": "direct", "c": null, "e": [["tile_f", "sp", [-1, 1, 8, 1]], ["tile_y", "sp", [-1, 2, 1, 1]], ["tile_x", "sp", [-1, 2, 8, 1]], ["tile_rc", "sp", [-1, 1]], ["tile_ry", "sp", [-1, 3]], ["tile_rx", "sp", [-1, 3]], ["auto_unroll_max_step", "ot", 0], ["unroll_explicit", "ot", 1]]}], "r": [[5.317515568910044e-06], 0, 7.62296462059021, 1596822334.6480653], "v": 0.1}
{"i": ["cuda -model=unknown", "topi_nn_depthwise_conv2d_nchw", [["TENSOR", [1, 8, 112, 112], "float32"], ["TENSOR", [8, 1, 3, 3], "float32"], [1, 1], [1, 1], [1, 1], "float32"], {}, ["depthwise_conv2d_nchw", [1, 8, 112, 112, "float32"], [8, 1, 3, 3, "float32"], [1, 1], [1, 1], [1, 1], "float32"], {"i": 496980, "t": "direct", "c": null, "e": [["tile_f", "sp", [-1, 1, 1, 1]], ["tile_y", "sp", [-1, 1, 14, 2]], ["tile_x", "sp", [-1, 1, 16, 1]], ["auto_unroll_max_step", "ot", 256], ["unroll_explicit", "ot", 0]]}], "r": [[3.712447909859601e-06], 0, 14.310479164123535, 1596823164.4604464], "v": 0.1}
{"i": ["cuda -model=unknown", "topi_nn_conv2d", [["TENSOR", [1, 8, 112, 112], "float32"], ["TENSOR", [16, 8, 1, 1], "float32"], [1, 1], [0, 0], [1, 1], "NCHW", "float32"], {}, ["conv2d", [1, 8, 112, 112, "float32"], [16, 8, 1, 1, "float32"], [1, 1], [0, 0], [1, 1], "NCHW", "float32"], {"i": 12529680, "t": "direct", "c": null, "e": [["tile_f", "sp", [-1, 1, 4, 4]], ["tile_y", "sp", [-1, 1, 2, 1]], ["tile_x", "sp", [-1, 1, 16, 1]], ["tile_rc", "sp", [-1, 4]], ["tile_ry", "sp", [-1, 1]], ["tile_rx", "sp", [-1, 1]], ["auto_unroll_max_step", "ot", 512], ["unroll_explicit", "ot", 1]]}], "r": [[3.4431680677151933e-06], 0, 62.8832151889801, 1596823869.3327868], "v": 0.1}
{"i": ["cuda -model=unknown", "topi_nn_depthwise_conv2d_nchw", [["TENSOR", [1, 16, 112, 112], "float32"], ["TENSOR", [16, 1, 3, 3], "float32"], [2, 2], [1, 1], [1, 1], "float32"], {}, ["depthwise_conv2d_nchw", [1, 16, 112, 112, "float32"], [16, 1, 3, 3, "float32"], [2, 2], [1, 1], [1, 1], "float32"], {"i": 1201830, "t": "direct", "c": null, "e": [["tile_f", "sp", [-1, 1, 1, 1]], ["tile_y", "sp", [-1, 1, 7, 1]], ["tile_x", "sp", [-1, 1, 56, 1]], ["auto_unroll_max_step", "ot", 1500], ["unroll_explicit", "ot", 1]]}], "r": [[3.942517621653353e-06], 0, 7.424428224563599, 1596824835.9153852], "v": 0.1}
{"i": ["cuda -model=unknown", "topi_nn_conv2d", [["TENSOR", [1, 16, 56, 56], "float32"], ["TENSOR", [32, 16, 1, 1], "float32"], [1, 1], [0, 0], [1, 1], "NCHW", "float32"], {}, ["conv2d", [1, 16, 56, 56, "float32"], [32, 16, 1, 1, "float32"], [1, 1], [0, 0], [1, 1], "NCHW", "float32"], {"i": 10165133, "t": "direct", "c": null, "e": [["tile_f", "sp", [-1, 4, 4, 1]], ["tile_y", "sp", [-1, 1, 1, 1]], ["tile_x", "sp", [-1, 1, 56, 1]], ["tile_rc", "sp", [-1, 8]], ["tile_ry", "sp", [-1, 1]], ["tile_rx", "sp", [-1, 1]], ["auto_unroll_max_step", "ot", 1500], ["unroll_explicit", "ot", 1]]}], "r": [[3.6683505281352026e-06], 0, 4.420671701431274, 1596825783.4204679], "v": 0.1}
{"i": ["cuda -model=unknown", "topi_nn_depthwise_conv2d_nchw", [["TENSOR", [1, 32, 56, 56], "float32"], ["TENSOR", [32, 1, 3, 3], "float32"], [1, 1], [1, 1], [1, 1], "float32"], {}, ["depthwise_conv2d_nchw", [1, 32, 56, 56, "float32"], [32, 1, 3, 3, "float32"], [1, 1], [1, 1], [1, 1], "float32"], {"i": 1892923, "t": "direct", "c": null, "e": [["tile_f", "sp", [-1, 1, 4, 1]], ["tile_y", "sp", [-1, 1, 7, 2]], ["tile_x", "sp", [-1, 1, 8, 1]], ["auto_unroll_max_step", "ot", 1500], ["unroll_explicit", "ot", 1]]}], "r": [[4.010268768736844e-06], 0, 79.50339388847351, 1596826439.9542532], "v": 0.1}
{"i": ["cuda -model=unknown", "topi_nn_conv2d", [["TENSOR", [1, 32, 56, 56], "float32"], ["TENSOR", [32, 32, 1, 1], "float32"], [1, 1], [0, 0], [1, 1], "NCHW", "float32"], {}, ["conv2d", [1, 32, 56, 56, "float32"], [32, 32, 1, 1, "float32"], [1, 1], [0, 0], [1, 1], "NCHW", "float32"], {"i": 3346632, "t": "direct", "c": null, "e": [["tile_f", "sp", [-1, 2, 8, 1]], ["tile_y", "sp", [-1, 2, 1, 1]], ["tile_x", "sp", [-1, 1, 28, 1]], ["tile_rc", "sp", [-1, 8]], ["tile_ry", "sp", [-1, 1]], ["tile_rx", "sp", [-1, 1]], ["auto_unroll_max_step", "ot", 512], ["unroll_explicit", "ot", 0]]}], "r": [[4.108350452838524e-06], 0, 47.386300802230835, 1596827380.764503], "v": 0.1}
{"i": ["cuda -model=unknown", "topi_nn_depthwise_conv2d_nchw", [["TENSOR", [1, 32, 56, 56], "float32"], ["TENSOR", [32, 1, 3, 3], "float32"], [2, 2], [1, 1], [1, 1], "float32"], {}, ["depthwise_conv2d_nchw", [1, 32, 56, 56, "float32"], [32, 1, 3, 3, "float32"], [2, 2], [1, 1], [1, 1], "float32"], {"i": 397040, "t": "direct", "c": null, "e": [["tile_f", "sp", [-1, 1, 1, 1]], ["tile_y", "sp", [-1, 1, 4, 1]], ["tile_x", "sp", [-1, 1, 28, 1]], ["auto_unroll_max_step", "ot", 256], ["unroll_explicit", "ot", 1]]}], "r": [[3.5806933398758185e-06], 0, 2.522900342941284, 1596827892.8923166], "v": 0.1}
{"i": ["cuda -model=unknown", "topi_nn_conv2d", [["TENSOR", [1, 32, 28, 28], "float32"], ["TENSOR", [64, 32, 1, 1], "float32"], [1, 1], [0, 0], [1, 1], "NCHW", "float32"], {}, ["conv2d", [1, 32, 28, 28, "float32"], [64, 32, 1, 1, "float32"], [1, 1], [0, 0], [1, 1], "NCHW", "float32"], {"i": 2073163, "t": "direct", "c": null, "e": [["tile_f", "sp", [-1, 1, 8, 2]], ["tile_y", "sp", [-1, 1, 1, 1]], ["tile_x", "sp", [-1, 1, 28, 1]], ["tile_rc", "sp", [-1, 8]], ["tile_ry", "sp", [-1, 1]], ["tile_rx", "sp", [-1, 1]], ["auto_unroll_max_step", "ot", 1500], ["unroll_explicit", "ot", 0]]}], "r": [[3.351546425813866e-06], 0, 23.307982921600342, 1596828913.4863849], "v": 0.1}
{"i": ["cuda -model=unknown", "topi_nn_depthwise_conv2d_nchw", [["TENSOR", [1, 64, 28, 28], "float32"], ["TENSOR", [64, 1, 3, 3], "float32"], [1, 1], [1, 1], [1, 1], "float32"], {}, ["depthwise_conv2d_nchw", [1, 64, 28, 28, "float32"], [64, 1, 3, 3, "float32"], [1, 1], [1, 1], [1, 1], "float32"], {"i": 730380, "t": "direct", "c": null, "e": [["tile_f", "sp", [-1, 1, 1, 1]], ["tile_y", "sp", [-1, 1, 14, 1]], ["tile_x", "sp", [-1, 1, 28, 1]], ["auto_unroll_max_step", "ot", 1500], ["unroll_explicit", "ot", 1]]}], "r": [[3.31341797876888e-06], 0, 26.541762351989746, 1596829238.8946974], "v": 0.1}
{"i": ["cuda -model=unknown", "topi_nn_conv2d", [["TENSOR", [1, 64, 28, 28], "float32"], ["TENSOR", [64, 64, 1, 1], "float32"], [1, 1], [0, 0], [1, 1], "NCHW", "float32"], {}, ["conv2d", [1, 64, 28, 28, "float32"], [64, 64, 1, 1, "float32"], [1, 1], [0, 0], [1, 1], "NCHW", "float32"], {"i": 2472983, "t": "direct", "c": null, "e": [["tile_f", "sp", [-1, 2, 16, 1]], ["tile_y", "sp", [-1, 1, 1, 1]], ["tile_x", "sp", [-1, 2, 14, 1]], ["tile_rc", "sp", [-1, 16]], ["tile_ry", "sp", [-1, 1]], ["tile_rx", "sp", [-1, 1]], ["auto_unroll_max_step", "ot", 1500], ["unroll_explicit", "ot", 0]]}], "r": [[4.373805154092617e-06], 0, 35.82380938529968, 1596830370.1742494], "v": 0.1}
{"i": ["cuda -model=unknown", "topi_nn_depthwise_conv2d_nchw", [["TENSOR", [1, 64, 28, 28], "float32"], ["TENSOR", [64, 1, 3, 3], "float32"], [2, 2], [1, 1], [1, 1], "float32"], {}, ["depthwise_conv2d_nchw", [1, 64, 28, 28, "float32"], [64, 1, 3, 3, "float32"], [2, 2], [1, 1], [1, 1], "float32"], {"i": 118944, "t": "direct", "c": null, "e": [["tile_f", "sp", [-1, 1, 1, 1]], ["tile_y", "sp", [-1, 1, 14, 1]], ["tile_x", "sp", [-1, 1, 14, 1]], ["auto_unroll_max_step", "ot", 1500], ["unroll_explicit", "ot", 1]]}], "r": [[3.516627781009161e-06], 0, 11.726132869720459, 1596831385.9310002], "v": 0.1}
{"i": ["cuda -model=unknown", "topi_nn_conv2d", [["TENSOR", [1, 64, 14, 14], "float32"], ["TENSOR", [128, 64, 1, 1], "float32"], [1, 1], [0, 0], [1, 1], "NCHW", "float32"], {}, ["conv2d", [1, 64, 14, 14, "float32"], [128, 64, 1, 1, "float32"], [1, 1], [0, 0], [1, 1], "NCHW", "float32"], {"i": 783866, "t": "direct", "c": null, "e": [["tile_f", "sp", [-1, 1, 16, 1]], ["tile_y", "sp", [-1, 1, 2, 1]], ["tile_x", "sp", [-1, 1, 14, 1]], ["tile_rc", "sp", [-1, 16]], ["tile_ry", "sp", [-1, 1]], ["tile_rx", "sp", [-1, 1]], ["auto_unroll_max_step", "ot", 0], ["unroll_explicit", "ot", 1]]}], "r": [[3.656848076689722e-06], 0, 57.98805832862854, 1596832098.712157], "v": 0.1}
{"i": ["cuda -model=unknown", "topi_nn_depthwise_conv2d_nchw", [["TENSOR", [1, 128, 14, 14], "float32"], ["TENSOR", [128, 1, 3, 3], "float32"], [1, 1], [1, 1], [1, 1], "float32"], {}, ["depthwise_conv2d_nchw", [1, 128, 14, 14, "float32"], [128, 1, 3, 3, "float32"], [1, 1], [1, 1], [1, 1], "float32"], {"i": 46586, "t": "direct", "c": null, "e": [["tile_f", "sp", [-1, 1, 16, 1]], ["tile_y", "sp", [-1, 1, 2, 1]], ["tile_x", "sp", [-1, 1, 14, 1]], ["auto_unroll_max_step", "ot", 256], ["unroll_explicit", "ot", 0]]}], "r": [[3.290600109629088e-06], 0, 34.655410051345825, 1596832485.389196], "v": 0.1}
{"i": ["cuda -model=unknown", "topi_nn_conv2d", [["TENSOR", [1, 128, 14, 14], "float32"], ["TENSOR", [128, 128, 1, 1], "float32"], [1, 1], [0, 0], [1, 1], "NCHW", "float32"], {}, ["conv2d", [1, 128, 14, 14, "float32"], [128, 128, 1, 1, "float32"], [1, 1], [0, 0], [1, 1], "NCHW", "float32"], {"i": 385106, "t": "direct", "c": null, "e": [["tile_f", "sp", [-1, 1, 16, 1]], ["tile_y", "sp", [-1, 1, 1, 2]], ["tile_x", "sp", [-1, 1, 14, 1]], ["tile_rc", "sp", [-1, 16]], ["tile_ry", "sp", [-1, 1]], ["tile_rx", "sp", [-1, 1]], ["auto_unroll_max_step", "ot", 512], ["unroll_explicit", "ot", 0]]}], "r": [[5.052299135311989e-06], 0, 51.00282883644104, 1596833120.0995295], "v": 0.1}
{"i": ["cuda -model=unknown", "topi_nn_depthwise_conv2d_nchw", [["TENSOR", [1, 128, 14, 14], "float32"], ["TENSOR", [128, 1, 3, 3], "float32"], [2, 2], [1, 1], [1, 1], "float32"], {}, ["depthwise_conv2d_nchw", [1, 128, 14, 14, "float32"], [128, 1, 3, 3, "float32"], [2, 2], [1, 1], [1, 1], "float32"], {"i": 8880, "t": "direct", "c": null, "e": [["tile_f", "sp", [-1, 1, 1, 1]], ["tile_y", "sp", [-1, 1, 7, 1]], ["tile_x", "sp", [-1, 1, 7, 1]], ["auto_unroll_max_step", "ot", 256], ["unroll_explicit", "ot", 1]]}], "r": [[3.484152628032345e-06], 0, 15.159868240356445, 1596834298.496989], "v": 0.1}
{"i": ["cuda -model=unknown", "topi_nn_conv2d", [["TENSOR", [1, 128, 7, 7], "float32"], ["TENSOR", [256, 128, 1, 1], "float32"], [1, 1], [0, 0], [1, 1], "NCHW", "float32"], {}, ["conv2d", [1, 128, 7, 7, "float32"], [256, 128, 1, 1, "float32"], [1, 1], [0, 0], [1, 1], "NCHW", "float32"], {"i": 54144, "t": "direct", "c": null, "e": [["tile_f", "sp", [-1, 1, 8, 1]], ["tile_y", "sp", [-1, 1, 1, 1]], ["tile_x", "sp", [-1, 1, 7, 1]], ["tile_rc", "sp", [-1, 16]], ["tile_ry", "sp", [-1, 1]], ["tile_rx", "sp", [-1, 1]], ["auto_unroll_max_step", "ot", 1500], ["unroll_explicit", "ot", 0]]}], "r": [[5.66566970551018e-06], 0, 22.27533507347107, 1596834676.2566333], "v": 0.1}
{"i": ["cuda -model=unknown", "topi_nn_depthwise_conv2d_nchw", [["TENSOR", [1, 256, 7, 7], "float32"], ["TENSOR", [256, 1, 3, 3], "float32"], [1, 1], [1, 1], [1, 1], "float32"], {}, ["depthwise_conv2d_nchw", [1, 256, 7, 7, "float32"], [256, 1, 3, 3, "float32"], [1, 1], [1, 1], [1, 1], "float32"], {"i": 12210, "t": "direct", "c": null, "e": [["tile_f", "sp", [-1, 1, 1, 1]], ["tile_y", "sp", [-1, 1, 7, 1]], ["tile_x", "sp", [-1, 1, 7, 1]], ["auto_unroll_max_step", "ot", 256], ["unroll_explicit", "ot", 1]]}], "r": [[3.332210849594075e-06], 0, 14.933728456497192, 1596835828.8476145], "v": 0.1}
{"i": ["cuda -model=unknown", "topi_nn_conv2d", [["TENSOR", [1, 256, 7, 7], "float32"], ["TENSOR", [256, 256, 1, 1], "float32"], [1, 1], [0, 0], [1, 1], "NCHW", "float32"], {}, ["conv2d", [1, 256, 7, 7, "float32"], [256, 256, 1, 1, "float32"], [1, 1], [0, 0], [1, 1], "NCHW", "float32"], {"i": 33024, "t": "direct", "c": null, "e": [["tile_f", "sp", [-1, 1, 8, 1]], ["tile_y", "sp", [-1, 1, 1, 1]], ["tile_x", "sp", [-1, 1, 7, 1]], ["tile_rc", "sp", [-1, 8]], ["tile_ry", "sp", [-1, 1]], ["tile_rx", "sp", [-1, 1]], ["auto_unroll_max_step", "ot", 512], ["unroll_explicit", "ot", 0]]}], "r": [[8.160640220877828e-06], 0, 47.47294878959656, 1596836373.06169], "v": 0.1}
