TVM/tvm-log/V100/gpu/onnx/1batch/gpu_onnx_1batch_mnasnet0_5.log
{"i": ["cuda -model=unknown", "topi_nn_conv2d", [["TENSOR", [1, 3, 224, 224], "float32"], ["TENSOR", [32, 3, 3, 3], "float32"], [2, 2], [1, 1], [1, 1], "NCHW", "float32"], {}, ["conv2d", [1, 3, 224, 224, "float32"], [32, 3, 3, 3, "float32"], [2, 2], [1, 1], [1, 1], "NCHW", "float32"], {"i": 6893897, "t": "direct", "c": null, "e": [["tile_f", "sp", [-1, 4, 8, 1]], ["tile_y", "sp", [-1, 1, 1, 2]], ["tile_x", "sp", [-1, 1, 28, 1]], ["tile_rc", "sp", [-1, 1]], ["tile_ry", "sp", [-1, 3]], ["tile_rx", "sp", [-1, 3]], ["auto_unroll_max_step", "ot", 0], ["unroll_explicit", "ot", 0]]}], "r": [[8.1910962307253e-06], 0, 11.583377599716187, 1597040093.1709979], "v": 0.1}
{"i": ["cuda -model=unknown", "topi_nn_depthwise_conv2d_nchw", [["TENSOR", [1, 32, 112, 112], "float32"], ["TENSOR", [32, 1, 3, 3], "float32"], [1, 1], [1, 1], [1, 1], "float32"], {}, ["depthwise_conv2d_nchw", [1, 32, 112, 112, "float32"], [32, 1, 3, 3, "float32"], [1, 1], [1, 1], [1, 1], "float32"], {"i": 5782840, "t": "direct", "c": null, "e": [["tile_f", "sp", [-1, 1, 1, 1]], ["tile_y", "sp", [-1, 1, 4, 4]], ["tile_x", "sp", [-1, 1, 16, 1]], ["auto_unroll_max_step", "ot", 1500], ["unroll_explicit", "ot", 1]]}], "r": [[6.370763185481229e-06], 0, 11.442378759384155, 1597040857.8760204], "v": 0.1}
{"i": ["cuda -model=unknown", "topi_nn_conv2d", [["TENSOR", [1, 32, 112, 112], "float32"], ["TENSOR", [16, 32, 1, 1], "float32"], [1, 1], [0, 0], [1, 1], "NCHW", "float32"], {}, ["conv2d", [1, 32, 112, 112, "float32"], [16, 32, 1, 1, "float32"], [1, 1], [0, 0], [1, 1], "NCHW", "float32"], {"i": 18812734, "t": "direct", "c": null, "e": [["tile_f", "sp", [-1, 1, 8, 2]], ["tile_y", "sp", [-1, 2, 1, 2]], ["tile_x", "sp", [-1, 1, 4, 2]], ["tile_rc", "sp", [-1, 8]], ["tile_ry", "sp", [-1, 1]], ["tile_rx", "sp", [-1, 1]], ["auto_unroll_max_step", "ot", 512], ["unroll_explicit", "ot", 1]]}], "r": [[8.604069219376197e-06], 0, 79.34776663780212, 1597041657.1835456], "v": 0.1}
{"i": ["cuda -model=unknown", "topi_nn_conv2d", [["TENSOR", [1, 16, 112, 112], "float32"], ["TENSOR", [48, 16, 1, 1], "float32"], [1, 1], [0, 0], [1, 1], "NCHW", "float32"], {}, ["conv2d", [1, 16, 112, 112, "float32"], [48, 16, 1, 1, "float32"], [1, 1], [0, 0], [1, 1], "NCHW", "float32"], {"i": 11565643, "t": "direct", "c": null, "e": [["tile_f", "sp", [-1, 1, 4, 4]], ["tile_y", "sp", [-1, 2, 2, 1]], ["tile_x", "sp", [-1, 2, 8, 1]], ["tile_rc", "sp", [-1, 16]], ["tile_ry", "sp", [-1, 1]], ["tile_rx", "sp", [-1, 1]], ["auto_unroll_max_step", "ot", 0], ["unroll_explicit", "ot", 0]]}], "r": [[1.0746236519927065e-05], 0, 11.684584379196167, 1597041796.5364354], "v": 0.1}
{"i": ["cuda -model=unknown", "topi_nn_depthwise_conv2d_nchw", [["TENSOR", [1, 48, 112, 112], "float32"], ["TENSOR", [48, 1, 3, 3], "float32"], [2, 2], [1, 1], [1, 1], "float32"], {}, ["depthwise_conv2d_nchw", [1, 48, 112, 112, "float32"], [48, 1, 3, 3, "float32"], [2, 2], [1, 1], [1, 1], "float32"], {"i": 4784360, "t": "direct", "c": null, "e": [["tile_f", "sp", [-1, 1, 1, 1]], ["tile_y", "sp", [-1, 1, 4, 1]], ["tile_x", "sp", [-1, 1, 28, 1]], ["auto_unroll_max_step", "ot", 1500], ["unroll_explicit", "ot", 1]]}], "r": [[6.040157934926958e-06], 0, 15.313804388046265, 1597042774.7892087], "v": 0.1}
{"i": ["cuda -model=unknown", "topi_nn_depthwise_conv2d_nchw", [["TENSOR", [1, 48, 56, 56], "float32"], ["TENSOR", [48, 1, 3, 3], "float32"], [1, 1], [1, 1], [1, 1], "float32"], {}, ["depthwise_conv2d_nchw", [1, 48, 56, 56, "float32"], [48, 1, 3, 3, "float32"], [1, 1], [1, 1], [1, 1], "float32"], {"i": 3891463, "t": "direct", "c": null, "e": [["tile_f", "sp", [-1, 1, 4, 1]], ["tile_y", "sp", [-1, 1, 2, 2]], ["tile_x", "sp", [-1, 1, 28, 1]], ["auto_unroll_max_step", "ot", 256], ["unroll_explicit", "ot", 1]]}], "r": [[4.694520504967506e-06], 0, 11.488545417785645, 1597043595.5431387], "v": 0.1}
{"i": ["cuda -model=unknown", "topi_nn_conv2d", [["TENSOR", [1, 48, 56, 56], "float32"], ["TENSOR", [16, 48, 1, 1], "float32"], [1, 1], [0, 0], [1, 1], "NCHW", "float32"], {}, ["conv2d", [1, 48, 56, 56, "float32"], [16, 48, 1, 1, "float32"], [1, 1], [0, 0], [1, 1], "NCHW", "float32"], {"i": 3399523, "t": "direct", "c": null, "e": [["tile_f", "sp", [-1, 8, 2, 1]], ["tile_y", "sp", [-1, 2, 2, 1]], ["tile_x", "sp", [-1, 1, 4, 1]], ["tile_rc", "sp", [-1, 8]], ["tile_ry", "sp", [-1, 1]], ["tile_rx", "sp", [-1, 1]], ["auto_unroll_max_step", "ot", 512], ["unroll_explicit", "ot", 0]]}], "r": [[7.15347282411769e-06], 0, 28.125378131866455, 1597043639.1998897], "v": 0.1}
{"i": ["cuda -model=unknown", "topi_nn_conv2d", [["TENSOR", [1, 16, 56, 56], "float32"], ["TENSOR", [48, 16, 1, 1], "float32"], [1, 1], [0, 0], [1, 1], "NCHW", "float32"], {}, ["conv2d", [1, 16, 56, 56, "float32"], [48, 16, 1, 1, "float32"], [1, 1], [0, 0], [1, 1], "NCHW", "float32"], {"i": 25335559, "t": "direct", "c": null, "e": [["tile_f", "sp", [-1, 4, 12, 1]], ["tile_y", "sp", [-1, 1, 2, 1]], ["tile_x", "sp", [-1, 1, 8, 1]], ["tile_rc", "sp", [-1, 8]], ["tile_ry", "sp", [-1, 1]], ["tile_rx", "sp", [-1, 1]], ["auto_unroll_max_step", "ot", 1500], ["unroll_explicit", "ot", 1]]}], "r": [[3.755488849608452e-06], 0, 106.5528666973114, 1597044834.3925161], "v": 0.1}
{"i": ["cuda -model=unknown", "topi_nn_depthwise_conv2d_nchw", [["TENSOR", [1, 48, 56, 56], "float32"], ["TENSOR", [48, 1, 5, 5], "float32"], [2, 2], [2, 2], [1, 1], "float32"], {}, ["depthwise_conv2d_nchw", [1, 48, 56, 56, "float32"], [48, 1, 5, 5, "float32"], [2, 2], [2, 2], [1, 1], "float32"], {"i": 1216600, "t": "direct", "c": null, "e": [["tile_f", "sp", [-1, 1, 1, 1]], ["tile_y", "sp", [-1, 1, 4, 1]], ["tile_x", "sp", [-1, 1, 28, 1]], ["auto_unroll_max_step", "ot", 1500], ["unroll_explicit", "ot", 1]]}], "r": [[4.399393436854944e-06], 0, 34.93312168121338, 1597045182.21976], "v": 0.1}
{"i": ["cuda -model=unknown", "topi_nn_conv2d", [["TENSOR", [1, 48, 28, 28], "float32"], ["TENSOR", [24, 48, 1, 1], "float32"], [1, 1], [0, 0], [1, 1], "NCHW", "float32"], {}, ["conv2d", [1, 48, 28, 28, "float32"], [24, 48, 1, 1, "float32"], [1, 1], [0, 0], [1, 1], "NCHW", "float32"], {"i": 3632029, "t": "direct", "c": null, "e": [["tile_f", "sp", [-1, 1, 24, 1]], ["tile_y", "sp", [-1, 1, 1, 1]], ["tile_x", "sp", [-1, 1, 14, 1]], ["tile_rc", "sp", [-1, 24]], ["tile_ry", "sp", [-1, 1]], ["tile_rx", "sp", [-1, 1]], ["auto_unroll_max_step", "ot", 1500], ["unroll_explicit", "ot", 0]]}], "r": [[3.6074000568604294e-06], 0, 37.74936580657959, 1597046283.925222], "v": 0.1}
{"i": ["cuda -model=unknown", "topi_nn_conv2d", [["TENSOR", [1, 24, 28, 28], "float32"], ["TENSOR", [72, 24, 1, 1], "float32"], [1, 1], [0, 0], [1, 1], "NCHW", "float32"], {}, ["conv2d", [1, 24, 28, 28, "float32"], [72, 24, 1, 1, "float32"], [1, 1], [0, 0], [1, 1], "NCHW", "float32"], {"i": 2057310, "t": "direct", "c": null, "e": [["tile_f", "sp", [-1, 1, 3, 3]], ["tile_y", "sp", [-1, 1, 2, 1]], ["tile_x", "sp", [-1, 1, 28, 1]], ["tile_rc", "sp", [-1, 12]], ["tile_ry", "sp", [-1, 1]], ["tile_rx", "sp", [-1, 1]], ["auto_unroll_max_step", "ot", 0], ["unroll_explicit", "ot", 0]]}], "r": [[3.5037489479196417e-06], 0, 80.36286664009094, 1597047050.78925], "v": 0.1}
{"i": ["cuda -model=unknown", "topi_nn_depthwise_conv2d_nchw", [["TENSOR", [1, 72, 28, 28], "float32"], ["TENSOR", [72, 1, 5, 5], "float32"], [1, 1], [2, 2], [1, 1], "float32"], {}, ["depthwise_conv2d_nchw", [1, 72, 28, 28, "float32"], [72, 1, 5, 5, "float32"], [1, 1], [2, 2], [1, 1], "float32"], {"i": 1739400, "t": "direct", "c": null, "e": [["tile_f", "sp", [-1, 1, 1, 1]], ["tile_y", "sp", [-1, 1, 28, 1]], ["tile_x", "sp", [-1, 1, 28, 1]], ["auto_unroll_max_step", "ot", 1500], ["unroll_explicit", "ot", 1]]}], "r": [[3.731819802967951e-06], 0, 45.77352046966553, 1597047607.4794507], "v": 0.1}
{"i": ["cuda -model=unknown", "topi_nn_conv2d", [["TENSOR", [1, 72, 28, 28], "float32"], ["TENSOR", [24, 72, 1, 1], "float32"], [1, 1], [0, 0], [1, 1], "NCHW", "float32"], {}, ["conv2d", [1, 72, 28, 28, "float32"], [24, 72, 1, 1, "float32"], [1, 1], [0, 0], [1, 1], "NCHW", "float32"], {"i": 5942427, "t": "direct", "c": null, "e": [["tile_f", "sp", [-1, 1, 12, 1]], ["tile_y", "sp", [-1, 1, 1, 1]], ["tile_x", "sp", [-1, 1, 28, 1]], ["tile_rc", "sp", [-1, 36]], ["tile_ry", "sp", [-1, 1]], ["tile_rx", "sp", [-1, 1]], ["auto_unroll_max_step", "ot", 0], ["unroll_explicit", "ot", 1]]}], "r": [[3.695595221781464e-06], 0, 66.26269960403442, 1597048714.5281987], "v": 0.1}
{"i": ["cuda -model=unknown", "topi_nn_conv2d", [["TENSOR", [1, 24, 28, 28], "float32"], ["TENSOR", [144, 24, 1, 1], "float32"], [1, 1], [0, 0], [1, 1], "NCHW", "float32"], {}, ["conv2d", [1, 24, 28, 28, "float32"], [144, 24, 1, 1, "float32"], [1, 1], [0, 0], [1, 1], "NCHW", "float32"], {"i": 17040220, "t": "direct", "c": null, "e": [["tile_f", "sp", [-1, 2, 4, 2]], ["tile_y", "sp", [-1, 1, 2, 1]], ["tile_x", "sp", [-1, 1, 28, 1]], ["tile_rc", "sp", [-1, 12]], ["tile_ry", "sp", [-1, 1]], ["tile_rx", "sp", [-1, 1]], ["auto_unroll_max_step", "ot", 0], ["unroll_explicit", "ot", 1]]}], "r": [[3.7049457209388587e-06], 0, 69.76466226577759, 1597049166.607764], "v": 0.1}
{"i": ["cuda -model=unknown", "topi_nn_depthwise_conv2d_nchw", [["TENSOR", [1, 144, 28, 28], "float32"], ["TENSOR", [144, 1, 5, 5], "float32"], [2, 2], [2, 2], [1, 1], "float32"], {}, ["depthwise_conv2d_nchw", [1, 144, 28, 28, "float32"], [144, 1, 5, 5, "float32"], [2, 2], [2, 2], [1, 1], "float32"], {"i": 406000, "t": "direct", "c": null, "e": [["tile_f", "sp", [-1, 1, 1, 1]], ["tile_y", "sp", [-1, 1, 14, 1]], ["tile_x", "sp", [-1, 1, 14, 1]], ["auto_unroll_max_step", "ot", 256], ["unroll_explicit", "ot", 1]]}], "r": [[3.914728230205002e-06], 0, 3.8387646675109863, 1597049671.8454044], "v": 0.1}
{"i": ["cuda -model=unknown", "topi_nn_conv2d", [["TENSOR", [1, 144, 14, 14], "float32"], ["TENSOR", [40, 144, 1, 1], "float32"], [1, 1], [0, 0], [1, 1], "NCHW", "float32"], {}, ["conv2d", [1, 144, 14, 14, "float32"], [40, 144, 1, 1, "float32"], [1, 1], [0, 0], [1, 1], "NCHW", "float32"], {"i": 1136662, "t": "direct", "c": null, "e": [["tile_f", "sp", [-1, 1, 8, 1]], ["tile_y", "sp", [-1, 1, 1, 1]], ["tile_x", "sp", [-1, 1, 14, 1]], ["tile_rc", "sp", [-1, 24]], ["tile_ry", "sp", [-1, 1]], ["tile_rx", "sp", [-1, 1]], ["auto_unroll_max_step", "ot", 0], ["unroll_explicit", "ot", 1]]}], "r": [[4.937684490474364e-06], 0, 11.384701251983643, 1597050819.0947518], "v": 0.1}
{"i": ["cuda -model=unknown", "topi_nn_depthwise_conv2d_nchw", [["TENSOR", [1, 240, 14, 14], "float32"], ["TENSOR", [240, 1, 5, 5], "float32"], [1, 1], [2, 2], [1, 1], "float32"], {}, ["depthwise_conv2d_nchw", [1, 240, 14, 14, "float32"], [240, 1, 5, 5, "float32"], [1, 1], [2, 2], [1, 1], "float32"], {"i": 362880, "t": "direct", "c": null, "e": [["tile_f", "sp", [-1, 1, 1, 1]], ["tile_y", "sp", [-1, 1, 14, 1]], ["tile_x", "sp", [-1, 1, 14, 1]], ["auto_unroll_max_step", "ot", 1500], ["unroll_explicit", "ot", 0]]}], "r": [[3.5222945864092374e-06], 0, 15.17306661605835, 1597050896.561828], "v": 0.1}
{"i": ["cuda -model=unknown", "topi_nn_conv2d", [["TENSOR", [1, 240, 14, 14], "float32"], ["TENSOR", [40, 240, 1, 1], "float32"], [1, 1], [0, 0], [1, 1], "NCHW", "float32"], {}, ["conv2d", [1, 240, 14, 14, "float32"], [40, 240, 1, 1, "float32"], [1, 1], [0, 0], [1, 1], "NCHW", "float32"], {"i": 1116182, "t": "direct", "c": null, "e": [["tile_f", "sp", [-1, 1, 8, 1]], ["tile_y", "sp", [-1, 1, 1, 1]], ["tile_x", "sp", [-1, 1, 14, 1]], ["tile_rc", "sp", [-1, 40]], ["tile_ry", "sp", [-1, 1]], ["tile_rx", "sp", [-1, 1]], ["auto_unroll_max_step", "ot", 1500], ["unroll_explicit", "ot", 0]]}], "r": [[5.029728371333789e-06], 0, 19.917790174484253, 1597051398.5367873], "v": 0.1}
{"i": ["cuda -model=unknown", "topi_nn_conv2d", [["TENSOR", [1, 40, 14, 14], "float32"], ["TENSOR", [240, 40, 1, 1], "float32"], [1, 1], [0, 0], [1, 1], "NCHW", "float32"], {}, ["conv2d", [1, 40, 14, 14, "float32"], [240, 40, 1, 1, "float32"], [1, 1], [0, 0], [1, 1], "NCHW", "float32"], {"i": 4374974, "t": "direct", "c": null, "e": [["tile_f", "sp", [-1, 1, 8, 3]], ["tile_y", "sp", [-1, 1, 2, 1]], ["tile_x", "sp", [-1, 1, 14, 1]], ["tile_rc", "sp", [-1, 20]], ["tile_ry", "sp", [-1, 1]], ["tile_rx", "sp", [-1, 1]], ["auto_unroll_max_step", "ot", 0], ["unroll_explicit", "ot", 1]]}], "r": [[3.6058128341069583e-06], 0, 3.6048905849456787, 1597052178.810072], "v": 0.1}
{"i": ["cuda -model=unknown", "topi_nn_depthwise_conv2d_nchw", [["TENSOR", [1, 240, 14, 14], "float32"], ["TENSOR", [240, 1, 3, 3], "float32"], [1, 1], [1, 1], [1, 1], "float32"], {}, ["depthwise_conv2d_nchw", [1, 240, 14, 14, "float32"], [240, 1, 3, 3, "float32"], [1, 1], [1, 1], [1, 1], "float32"], {"i": 631716, "t": "direct", "c": null, "e": [["tile_f", "sp", [-1, 1, 3, 1]], ["tile_y", "sp", [-1, 1, 14, 1]], ["tile_x", "sp", [-1, 1, 7, 1]], ["auto_unroll_max_step", "ot", 256], ["unroll_explicit", "ot", 1]]}], "r": [[3.3363776918731906e-06], 0, 91.90479588508606, 1597053260.9295297], "v": 0.1}
{"i": ["cuda -model=unknown", "topi_nn_conv2d", [["TENSOR", [1, 240, 14, 14], "float32"], ["TENSOR", [48, 240, 1, 1], "float32"], [1, 1], [0, 0], [1, 1], "NCHW", "float32"], {}, ["conv2d", [1, 240, 14, 14, "float32"], [48, 240, 1, 1, "float32"], [1, 1], [0, 0], [1, 1], "NCHW", "float32"], {"i": 2024997, "t": "direct", "c": null, "e": [["tile_f", "sp", [-1, 1, 12, 1]], ["tile_y", "sp", [-1, 1, 1, 1]], ["tile_x", "sp", [-1, 1, 14, 1]], ["tile_rc", "sp", [-1, 60]], ["tile_ry", "sp", [-1, 1]], ["tile_rx", "sp", [-1, 1]], ["auto_unroll_max_step", "ot", 1500], ["unroll_explicit", "ot", 0]]}], "r": [[5.601258893809255e-06], 0, 66.8369529247284, 1597053579.553729], "v": 0.1}
{"i": ["cuda -model=unknown", "topi_nn_depthwise_conv2d_nchw", [["TENSOR", [1, 288, 14, 14], "float32"], ["TENSOR", [288, 1, 3, 3], "float32"], [1, 1], [1, 1], [1, 1], "float32"], {}, ["depthwise_conv2d_nchw", [1, 288, 14, 14, "float32"], [288, 1, 3, 3, "float32"], [1, 1], [1, 1], [1, 1], "float32"], {"i": 792400, "t": "direct", "c": null, "e": [["tile_f", "sp", [-1, 1, 1, 1]], ["tile_y", "sp", [-1, 2, 7, 1]], ["tile_x", "sp", [-1, 1, 14, 1]], ["auto_unroll_max_step", "ot", 1500], ["unroll_explicit", "ot", 1]]}], "r": [[3.489415381377014e-06], 0, 38.19788336753845, 1597054057.6012137], "v": 0.1}
{"i": ["cuda -model=unknown", "topi_nn_conv2d", [["TENSOR", [1, 288, 14, 14], "float32"], ["TENSOR", [48, 288, 1, 1], "float32"], [1, 1], [0, 0], [1, 1], "NCHW", "float32"], {}, ["conv2d", [1, 288, 14, 14, "float32"], [48, 288, 1, 1, "float32"], [1, 1], [0, 0], [1, 1], "NCHW", "float32"], {"i": 1093157, "t": "direct", "c": null, "e": [["tile_f", "sp", [-1, 1, 12, 1]], ["tile_y", "sp", [-1, 1, 1, 1]], ["tile_x", "sp", [-1, 1, 14, 1]], ["tile_rc", "sp", [-1, 36]], ["tile_ry", "sp", [-1, 1]], ["tile_rx", "sp", [-1, 1]], ["auto_unroll_max_step", "ot", 512], ["unroll_explicit", "ot", 0]]}], "r": [[6.252981224826361e-06], 0, 55.57242798805237, 1597054564.5169837], "v": 0.1}
{"i": ["cuda -model=unknown", "topi_nn_conv2d", [["TENSOR", [1, 48, 14, 14], "float32"], ["TENSOR", [288, 48, 1, 1], "float32"], [1, 1], [0, 0], [1, 1], "NCHW", "float32"], {}, ["conv2d", [1, 48, 14, 14, "float32"], [288, 48, 1, 1, "float32"], [1, 1], [0, 0], [1, 1], "NCHW", "float32"], {"i": 1220997, "t": "direct", "c": null, "e": [["tile_f", "sp", [-1, 1, 16, 2]], ["tile_y", "sp", [-1, 1, 2, 1]], ["tile_x", "sp", [-1, 1, 14, 1]], ["tile_rc", "sp", [-1, 24]], ["tile_ry", "sp", [-1, 1]], ["tile_rx", "sp", [-1, 1]], ["auto_unroll_max_step", "ot", 0], ["unroll_explicit", "ot", 0]]}], "r": [[4.021974341850144e-06], 0, 7.457858562469482, 1597055169.8838296], "v": 0.1}
{"i": ["cuda -model=unknown", "topi_nn_depthwise_conv2d_nchw", [["TENSOR", [1, 288, 14, 14], "float32"], ["TENSOR", [288, 1, 5, 5], "float32"], [2, 2], [2, 2], [1, 1], "float32"], {}, ["depthwise_conv2d_nchw", [1, 288, 14, 14, "float32"], [288, 1, 5, 5, "float32"], [2, 2], [2, 2], [1, 1], "float32"], {"i": 49840, "t": "direct", "c": null, "e": [["tile_f", "sp", [-1, 1, 1, 1]], ["tile_y", "sp", [-1, 7, 1, 1]], ["tile_x", "sp", [-1, 1, 7, 1]], ["auto_unroll_max_step", "ot", 1500], ["unroll_explicit", "ot", 1]]}], "r": [[3.566172241924662e-06], 0, 83.97145366668701, 1597056189.274257], "v": 0.1}
{"i": ["cuda -model=unknown", "topi_nn_conv2d", [["TENSOR", [1, 288, 7, 7], "float32"], ["TENSOR", [96, 288, 1, 1], "float32"], [1, 1], [0, 0], [1, 1], "NCHW", "float32"], {}, ["conv2d", [1, 288, 7, 7, "float32"], [96, 288, 1, 1, "float32"], [1, 1], [0, 0], [1, 1], "NCHW", "float32"], {"i": 374575, "t": "direct", "c": null, "e": [["tile_f", "sp", [-1, 1, 12, 1]], ["tile_y", "sp", [-1, 1, 1, 1]], ["tile_x", "sp", [-1, 1, 7, 1]], ["tile_rc", "sp", [-1, 72]], ["tile_ry", "sp", [-1, 1]], ["tile_rx", "sp", [-1, 1]], ["auto_unroll_max_step", "ot", 1500], ["unroll_explicit", "ot", 1]]}], "r": [[6.44153895517575e-06], 0, 40.56849980354309, 1597057075.3755395], "v": 0.1}
{"i": ["cuda -model=unknown", "topi_nn_depthwise_conv2d_nchw", [["TENSOR", [1, 576, 7, 7], "float32"], ["TENSOR", [576, 1, 5, 5], "float32"], [1, 1], [2, 2], [1, 1], "float32"], {}, ["depthwise_conv2d_nchw", [1, 576, 7, 7, "float32"], [576, 1, 5, 5, "float32"], [1, 1], [2, 2], [1, 1], "float32"], {"i": 8421, "t": "direct", "c": null, "e": [["tile_f", "sp", [-1, 1, 2, 1]], ["tile_y", "sp", [-1, 1, 7, 1]], ["tile_x", "sp", [-1, 1, 7, 1]], ["auto_unroll_max_step", "ot", 0], ["unroll_explicit", "ot", 0]]}], "r": [[3.7114631538180174e-06], 0, 56.736098766326904, 1597057281.2834053], "v": 0.1}
{"i": ["cuda -model=unknown", "topi_nn_conv2d", [["TENSOR", [1, 576, 7, 7], "float32"], ["TENSOR", [96, 576, 1, 1], "float32"], [1, 1], [0, 0], [1, 1], "NCHW", "float32"], {}, ["conv2d", [1, 576, 7, 7, "float32"], [96, 576, 1, 1, "float32"], [1, 1], [0, 0], [1, 1], "NCHW", "float32"], {"i": 184623, "t": "direct", "c": null, "e": [["tile_f", "sp", [-1, 1, 12, 1]], ["tile_y", "sp", [-1, 1, 1, 1]], ["tile_x", "sp", [-1, 1, 7, 1]], ["tile_rc", "sp", [-1, 18]], ["tile_ry", "sp", [-1, 1]], ["tile_rx", "sp", [-1, 1]], ["auto_unroll_max_step", "ot", 1500], ["unroll_explicit", "ot", 0]]}], "r": [[1.066828166922683e-05], 0, 17.063289880752563, 1597058303.2109575], "v": 0.1}
{"i": ["cuda -model=unknown", "topi_nn_conv2d", [["TENSOR", [1, 96, 7, 7], "float32"], ["TENSOR", [576, 96, 1, 1], "float32"], [1, 1], [0, 0], [1, 1], "NCHW", "float32"], {}, ["conv2d", [1, 96, 7, 7, "float32"], [576, 96, 1, 1, "float32"], [1, 1], [0, 0], [1, 1], "NCHW", "float32"], {"i": 465414, "t": "direct", "c": null, "e": [["tile_f", "sp", [-1, 2, 4, 1]], ["tile_y", "sp", [-1, 1, 7, 1]], ["tile_x", "sp", [-1, 1, 7, 1]], ["tile_rc", "sp", [-1, 48]], ["tile_ry", "sp", [-1, 1]], ["tile_rx", "sp", [-1, 1]], ["auto_unroll_max_step", "ot", 1500], ["unroll_explicit", "ot", 0]]}], "r": [[5.11708360354518e-06], 0, 94.0719153881073, 1597059414.696596], "v": 0.1}
{"i": ["cuda -model=unknown", "topi_nn_depthwise_conv2d_nchw", [["TENSOR", [1, 576, 7, 7], "float32"], ["TENSOR", [576, 1, 3, 3], "float32"], [1, 1], [1, 1], [1, 1], "float32"], {}, ["depthwise_conv2d_nchw", [1, 576, 7, 7, "float32"], [576, 1, 3, 3, "float32"], [1, 1], [1, 1], [1, 1], "float32"], {"i": 62228, "t": "direct", "c": null, "e": [["tile_f", "sp", [-1, 1, 6, 1]], ["tile_y", "sp", [-1, 1, 7, 1]], ["tile_x", "sp", [-1, 1, 7, 1]], ["auto_unroll_max_step", "ot", 256], ["unroll_explicit", "ot", 1]]}], "r": [[3.338421423840467e-06], 0, 26.698875904083252, 1597060127.3167644], "v": 0.1}
{"i": ["cuda -model=unknown", "topi_nn_conv2d", [["TENSOR", [1, 576, 7, 7], "float32"], ["TENSOR", [160, 576, 1, 1], "float32"], [1, 1], [0, 0], [1, 1], "NCHW", "float32"], {}, ["conv2d", [1, 576, 7, 7, "float32"], [160, 576, 1, 1, "float32"], [1, 1], [0, 0], [1, 1], "NCHW", "float32"], {"i": 417628, "t": "direct", "c": null, "e": [["tile_f", "sp", [-1, 1, 8, 2]], ["tile_y", "sp", [-1, 1, 1, 1]], ["tile_x", "sp", [-1, 1, 7, 1]], ["tile_rc", "sp", [-1, 32]], ["tile_ry", "sp", [-1, 1]], ["tile_rx", "sp", [-1, 1]], ["auto_unroll_max_step", "ot", 1500], ["unroll_explicit", "ot", 1]]}], "r": [[1.4893942158830275e-05], 0, 57.86831784248352, 1597060891.6387184], "v": 0.1}
{"i": ["cuda -model=unknown", "topi_nn_conv2d", [["TENSOR", [1, 160, 7, 7], "float32"], ["TENSOR", [1280, 160, 1, 1], "float32"], [1, 1], [0, 0], [1, 1], "NCHW", "float32"], {}, ["conv2d", [1, 160, 7, 7, "float32"], [1280, 160, 1, 1, "float32"], [1, 1], [0, 0], [1, 1], "NCHW", "float32"], {"i": 228418, "t": "direct", "c": null, "e": [["tile_f", "sp", [-1, 2, 8, 1]], ["tile_y", "sp", [-1, 1, 7, 1]], ["tile_x", "sp", [-1, 1, 7, 1]], ["tile_rc", "sp", [-1, 40]], ["tile_ry", "sp", [-1, 1]], ["tile_rx", "sp", [-1, 1]], ["auto_unroll_max_step", "ot", 512], ["unroll_explicit", "ot", 0]]}], "r": [[9.088788489785018e-06], 0, 3.9046449661254883, 1597061999.23593], "v": 0.1}
