TVM/tvm-log/V100/gpu/onnx/1batch/gpu_onnx_1batch_resnet152.log
{"i": ["cuda -model=unknown", "topi_nn_conv2d", [["TENSOR", [1, 1024, 14, 14], "float32"], ["TENSOR", [2048, 1024, 1, 1], "float32"], [2, 2], [0, 0], [1, 1], "NCHW", "float32"], {}, ["conv2d", [1, 1024, 14, 14, "float32"], [2048, 1024, 1, 1, "float32"], [2, 2], [0, 0], [1, 1], "NCHW", "float32"], {"i": 340755, "t": "direct", "c": null, "e": [["tile_f", "sp", [-1, 2, 32, 1]], ["tile_y", "sp", [-1, 1, 1, 1]], ["tile_x", "sp", [-1, 1, 7, 1]], ["tile_rc", "sp", [-1, 8]], ["tile_ry", "sp", [-1, 1]], ["tile_rx", "sp", [-1, 1]], ["auto_unroll_max_step", "ot", 1500], ["unroll_explicit", "ot", 1]]}], "r": [[0.0001277686658837346], 0, 12.19872784614563, 1596786953.8208525], "v": 0.1}
{"i": ["cuda -model=unknown", "topi_nn_conv2d", [["TENSOR", [1, 512, 28, 28], "float32"], ["TENSOR", [1024, 512, 1, 1], "float32"], [2, 2], [0, 0], [1, 1], "NCHW", "float32"], {}, ["conv2d", [1, 512, 28, 28, "float32"], [1024, 512, 1, 1, "float32"], [2, 2], [0, 0], [1, 1], "NCHW", "float32"], {"i": 3199913, "t": "direct", "c": null, "e": [["tile_f", "sp", [-1, 1, 8, 4]], ["tile_y", "sp", [-1, 1, 2, 1]], ["tile_x", "sp", [-1, 1, 7, 2]], ["tile_rc", "sp", [-1, 8]], ["tile_ry", "sp", [-1, 1]], ["tile_rx", "sp", [-1, 1]], ["auto_unroll_max_step", "ot", 512], ["unroll_explicit", "ot", 1]]}], "r": [[6.90606152356359e-05], 0, 96.03225183486938, 1596787677.6179216], "v": 0.1}
{"i": ["cuda -model=unknown", "topi_nn_conv2d", [["TENSOR", [1, 256, 56, 56], "float32"], ["TENSOR", [512, 256, 1, 1], "float32"], [2, 2], [0, 0], [1, 1], "NCHW", "float32"], {}, ["conv2d", [1, 256, 56, 56, "float32"], [512, 256, 1, 1, "float32"], [2, 2], [0, 0], [1, 1], "NCHW", "float32"], {"i": 16055246, "t": "direct", "c": null, "e": [["tile_f", "sp", [-1, 2, 16, 2]], ["tile_y", "sp", [-1, 1, 1, 2]], ["tile_x", "sp", [-1, 1, 7, 2]], ["tile_rc", "sp", [-1, 1]], ["tile_ry", "sp", [-1, 1]], ["tile_rx", "sp", [-1, 1]], ["auto_unroll_max_step", "ot", 1500], ["unroll_explicit", "ot", 1]]}], "r": [[8.042181016949153e-05], 0, 7.065827131271362, 1596788589.9499857], "v": 0.1}
{"i": ["cuda -model=unknown", "topi_nn_conv2d", [["TENSOR", [1, 3, 224, 224], "float32"], ["TENSOR", [64, 3, 7, 7], "float32"], [2, 2], [3, 3], [1, 1], "NCHW", "float32"], {}, ["conv2d", [1, 3, 224, 224, "float32"], [64, 3, 7, 7, "float32"], [2, 2], [3, 3], [1, 1], "NCHW", "float32"], {"i": 72845240, "t": "direct", "c": null, "e": [["tile_f", "sp", [-1, 4, 8, 1]], ["tile_y", "sp", [-1, 1, 1, 2]], ["tile_x", "sp", [-1, 2, 14, 1]], ["tile_rc", "sp", [-1, 1]], ["tile_ry", "sp", [-1, 1]], ["tile_rx", "sp", [-1, 7]], ["auto_unroll_max_step", "ot", 1500], ["unroll_explicit", "ot", 1]]}], "r": [[3.862069068028452e-05], 0, 13.173657894134521, 1596789637.048641], "v": 0.1}
{"i": ["cuda -model=unknown", "topi_nn_conv2d", [["TENSOR", [1, 64, 56, 56], "float32"], ["TENSOR", [64, 64, 1, 1], "float32"], [1, 1], [0, 0], [1, 1], "NCHW", "float32"], {}, ["conv2d", [1, 64, 56, 56, "float32"], [64, 64, 1, 1, "float32"], [1, 1], [0, 0], [1, 1], "NCHW", "float32"], {"i": 9288287, "t": "direct", "c": null, "e": [["tile_f", "sp", [-1, 1, 4, 8]], ["tile_y", "sp", [-1, 1, 4, 1]], ["tile_x", "sp", [-1, 1, 8, 1]], ["tile_rc", "sp", [-1, 8]], ["tile_ry", "sp", [-1, 1]], ["tile_rx", "sp", [-1, 1]], ["auto_unroll_max_step", "ot", 1500], ["unroll_explicit", "ot", 0]]}], "r": [[7.806256184781335e-06], 0, 22.657799005508423, 1596790396.411878], "v": 0.1}
{"i": ["cuda -model=unknown", "topi_nn_conv2d", [["TENSOR", [1, 256, 56, 56], "float32"], ["TENSOR", [64, 256, 1, 1], "float32"], [1, 1], [0, 0], [1, 1], "NCHW", "float32"], {}, ["conv2d", [1, 256, 56, 56, "float32"], [64, 256, 1, 1, "float32"], [1, 1], [0, 0], [1, 1], "NCHW", "float32"], {"i": 25955710, "t": "direct", "c": null, "e": [["tile_f", "sp", [-1, 1, 16, 2]], ["tile_y", "sp", [-1, 1, 2, 2]], ["tile_x", "sp", [-1, 1, 8, 1]], ["tile_rc", "sp", [-1, 8]], ["tile_ry", "sp", [-1, 1]], ["tile_rx", "sp", [-1, 1]], ["auto_unroll_max_step", "ot", 1500], ["unroll_explicit", "ot", 1]]}], "r": [[2.303373748086595e-05], 0, 108.52493071556091, 1596791325.9909098], "v": 0.1}
{"i": ["cuda -model=unknown", "topi_nn_conv2d", [["TENSOR", [1, 64, 56, 56], "float32"], ["TENSOR", [64, 64, 3, 3], "float32"], [1, 1], [1, 1], [1, 1], "NCHW", "float32"], {}, ["conv2d", [1, 64, 56, 56, "float32"], [64, 64, 3, 3, "float32"], [1, 1], [1, 1], [1, 1], "NCHW", "float32"], {"i": 153361, "t": "winograd", "c": null, "e": [["tile_b", "sp", [-1, 1, 1, 1]], ["tile_y", "sp", [-1, 1, 8, 4]], ["tile_x", "sp", [-1, 2, 14, 1]], ["tile_rc", "sp", [-1, 16]], ["auto_unroll_max_step", "ot", 1500], ["unroll_explicit", "ot", 0]]}], "r": [[2.38428424966201e-05], 0, 5.672098636627197, 1596792709.1158814], "v": 0.1}
{"i": ["cuda -model=unknown", "topi_nn_conv2d", [["TENSOR", [1, 64, 56, 56], "float32"], ["TENSOR", [256, 64, 1, 1], "float32"], [1, 1], [0, 0], [1, 1], "NCHW", "float32"], {}, ["conv2d", [1, 64, 56, 56, "float32"], [256, 64, 1, 1, "float32"], [1, 1], [0, 0], [1, 1], "NCHW", "float32"], {"i": 18313418, "t": "direct", "c": null, "e": [["tile_f", "sp", [-1, 4, 8, 2]], ["tile_y", "sp", [-1, 1, 1, 2]], ["tile_x", "sp", [-1, 1, 28, 1]], ["tile_rc", "sp", [-1, 8]], ["tile_ry", "sp", [-1, 1]], ["tile_rx", "sp", [-1, 1]], ["auto_unroll_max_step", "ot", 1500], ["unroll_explicit", "ot", 0]]}], "r": [[1.6813363261344334e-05], 0, 14.679003238677979, 1596793063.3089075], "v": 0.1}
{"i": ["cuda -model=unknown", "topi_nn_conv2d", [["TENSOR", [1, 256, 56, 56], "float32"], ["TENSOR", [128, 256, 1, 1], "float32"], [1, 1], [0, 0], [1, 1], "NCHW", "float32"], {}, ["conv2d", [1, 256, 56, 56, "float32"], [128, 256, 1, 1, "float32"], [1, 1], [0, 0], [1, 1], "NCHW", "float32"], {"i": 16343543, "t": "direct", "c": null, "e": [["tile_f", "sp", [-1, 4, 8, 1]], ["tile_y", "sp", [-1, 1, 2, 2]], ["tile_x", "sp", [-1, 1, 8, 1]], ["tile_rc", "sp", [-1, 8]], ["tile_ry", "sp", [-1, 1]], ["tile_rx", "sp", [-1, 1]], ["auto_unroll_max_step", "ot", 1500], ["unroll_explicit", "ot", 0]]}], "r": [[3.628788651146867e-05], 0, 22.258537530899048, 1596793705.6381865], "v": 0.1}
{"i": ["cuda -model=unknown", "topi_nn_conv2d", [["TENSOR", [1, 128, 56, 56], "float32"], ["TENSOR", [128, 128, 3, 3], "float32"], [2, 2], [1, 1], [1, 1], "NCHW", "float32"], {}, ["conv2d", [1, 128, 56, 56, "float32"], [128, 128, 3, 3, "float32"], [2, 2], [1, 1], [1, 1], "NCHW", "float32"], {"i": 28348854, "t": "direct", "c": null, "e": [["tile_f", "sp", [-1, 1, 8, 2]], ["tile_y", "sp", [-1, 1, 1, 1]], ["tile_x", "sp", [-1, 1, 14, 2]], ["tile_rc", "sp", [-1, 8]], ["tile_ry", "sp", [-1, 1]], ["tile_rx", "sp", [-1, 3]], ["auto_unroll_max_step", "ot", 512], ["unroll_explicit", "ot", 1]]}], "r": [[7.544054175438596e-05], 0, 19.07278609275818, 1596794322.1585126], "v": 0.1}
{"i": ["cuda -model=unknown", "topi_nn_conv2d", [["TENSOR", [1, 512, 28, 28], "float32"], ["TENSOR", [128, 512, 1, 1], "float32"], [1, 1], [0, 0], [1, 1], "NCHW", "float32"], {}, ["conv2d", [1, 512, 28, 28, "float32"], [128, 512, 1, 1, "float32"], [1, 1], [0, 0], [1, 1], "NCHW", "float32"], {"i": 4689622, "t": "direct", "c": null, "e": [["tile_f", "sp", [-1, 2, 8, 1]], ["tile_y", "sp", [-1, 1, 1, 1]], ["tile_x", "sp", [-1, 1, 28, 1]], ["tile_rc", "sp", [-1, 16]], ["tile_ry", "sp", [-1, 1]], ["tile_rx", "sp", [-1, 1]], ["auto_unroll_max_step", "ot", 1500], ["unroll_explicit", "ot", 0]]}], "r": [[2.8797114479945616e-05], 0, 112.75637555122375, 1596795600.9841392], "v": 0.1}
{"i": ["cuda -model=unknown", "topi_nn_conv2d", [["TENSOR", [1, 128, 28, 28], "float32"], ["TENSOR", [128, 128, 3, 3], "float32"], [1, 1], [1, 1], [1, 1], "NCHW", "float32"], {}, ["conv2d", [1, 128, 28, 28, "float32"], [128, 128, 3, 3, "float32"], [1, 1], [1, 1], [1, 1], "NCHW", "float32"], {"i": 27399, "t": "winograd", "c": null, "e": [["tile_b", "sp", [-1, 1, 1, 1]], ["tile_y", "sp", [-1, 8, 1, 2]], ["tile_x", "sp", [-1, 1, 28, 1]], ["tile_rc", "sp", [-1, 4]], ["auto_unroll_max_step", "ot", 0], ["unroll_explicit", "ot", 0]]}], "r": [[2.870497014115092e-05], 0, 3.159935474395752, 1596796634.271773], "v": 0.1}
{"i": ["cuda -model=unknown", "topi_nn_conv2d", [["TENSOR", [1, 128, 28, 28], "float32"], ["TENSOR", [512, 128, 1, 1], "float32"], [1, 1], [0, 0], [1, 1], "NCHW", "float32"], {}, ["conv2d", [1, 128, 28, 28, "float32"], [512, 128, 1, 1, "float32"], [1, 1], [0, 0], [1, 1], "NCHW", "float32"], {"i": 7193589, "t": "direct", "c": null, "e": [["tile_f", "sp", [-1, 4, 8, 1]], ["tile_y", "sp", [-1, 1, 1, 2]], ["tile_x", "sp", [-1, 1, 28, 1]], ["tile_rc", "sp", [-1, 16]], ["tile_ry", "sp", [-1, 1]], ["tile_rx", "sp", [-1, 1]], ["auto_unroll_max_step", "ot", 1500], ["unroll_explicit", "ot", 0]]}], "r": [[1.821031828854683e-05], 0, 99.02390241622925, 1596796842.9839175], "v": 0.1}
{"i": ["cuda -model=unknown", "topi_nn_conv2d", [["TENSOR", [1, 512, 28, 28], "float32"], ["TENSOR", [256, 512, 1, 1], "float32"], [1, 1], [0, 0], [1, 1], "NCHW", "float32"], {}, ["conv2d", [1, 512, 28, 28, "float32"], [256, 512, 1, 1, "float32"], [1, 1], [0, 0], [1, 1], "NCHW", "float32"], {"i": 3867626, "t": "direct", "c": null, "e": [["tile_f", "sp", [-1, 4, 8, 1]], ["tile_y", "sp", [-1, 1, 1, 1]], ["tile_x", "sp", [-1, 1, 14, 2]], ["tile_rc", "sp", [-1, 16]], ["tile_ry", "sp", [-1, 1]], ["tile_rx", "sp", [-1, 1]], ["auto_unroll_max_step", "ot", 512], ["unroll_explicit", "ot", 0]]}], "r": [[4.374471557747636e-05], 0, 36.350690603256226, 1596797457.1187663], "v": 0.1}
{"i": ["cuda -model=unknown", "topi_nn_conv2d", [["TENSOR", [1, 256, 28, 28], "float32"], ["TENSOR", [256, 256, 3, 3], "float32"], [2, 2], [1, 1], [1, 1], "NCHW", "float32"], {}, ["conv2d", [1, 256, 28, 28, "float32"], [256, 256, 3, 3, "float32"], [2, 2], [1, 1], [1, 1], "NCHW", "float32"], {"i": 8829510, "t": "direct", "c": null, "e": [["tile_f", "sp", [-1, 1, 16, 1]], ["tile_y", "sp", [-1, 1, 14, 1]], ["tile_x", "sp", [-1, 1, 1, 1]], ["tile_rc", "sp", [-1, 4]], ["tile_ry", "sp", [-1, 3]], ["tile_rx", "sp", [-1, 3]], ["auto_unroll_max_step", "ot", 1500], ["unroll_explicit", "ot", 1]]}], "r": [[0.00010419171928120447], 0, 6.915459632873535, 1596798811.748018], "v": 0.1}
{"i": ["cuda -model=unknown", "topi_nn_conv2d", [["TENSOR", [1, 1024, 14, 14], "float32"], ["TENSOR", [256, 1024, 1, 1], "float32"], [1, 1], [0, 0], [1, 1], "NCHW", "float32"], {}, ["conv2d", [1, 1024, 14, 14, "float32"], [256, 1024, 1, 1, "float32"], [1, 1], [0, 0], [1, 1], "NCHW", "float32"], {"i": 2556206, "t": "direct", "c": null, "e": [["tile_f", "sp", [-1, 4, 8, 1]], ["tile_y", "sp", [-1, 1, 2, 1]], ["tile_x", "sp", [-1, 1, 14, 1]], ["tile_rc", "sp", [-1, 32]], ["tile_ry", "sp", [-1, 1]], ["tile_rx", "sp", [-1, 1]], ["auto_unroll_max_step", "ot", 1500], ["unroll_explicit", "ot", 1]]}], "r": [[4.30001454397725e-05], 0, 10.582199335098267, 1596799023.0049636], "v": 0.1}
{"i": ["cuda -model=unknown", "topi_nn_conv2d", [["TENSOR", [1, 256, 14, 14], "float32"], ["TENSOR", [256, 256, 3, 3], "float32"], [1, 1], [1, 1], [1, 1], "NCHW", "float32"], {}, ["conv2d", [1, 256, 14, 14, "float32"], [256, 256, 3, 3, "float32"], [1, 1], [1, 1], [1, 1], "NCHW", "float32"], {"i": 83445, "t": "winograd", "c": null, "e": [["tile_b", "sp", [-1, 1, 1, 1]], ["tile_y", "sp", [-1, 1, 4, 8]], ["tile_x", "sp", [-1, 1, 49, 1]], ["tile_rc", "sp", [-1, 32]], ["auto_unroll_max_step", "ot", 1500], ["unroll_explicit", "ot", 1]]}], "r": [[3.1113425040459024e-05], 0, 81.89937424659729, 1596799754.4767044], "v": 0.1}
{"i": ["cuda -model=unknown", "topi_nn_conv2d", [["TENSOR", [1, 256, 14, 14], "float32"], ["TENSOR", [1024, 256, 1, 1], "float32"], [1, 1], [0, 0], [1, 1], "NCHW", "float32"], {}, ["conv2d", [1, 256, 14, 14, "float32"], [1024, 256, 1, 1, "float32"], [1, 1], [0, 0], [1, 1], "NCHW", "float32"], {"i": 1647678, "t": "direct", "c": null, "e": [["tile_f", "sp", [-1, 4, 8, 1]], ["tile_y", "sp", [-1, 2, 1, 1]], ["tile_x", "sp", [-1, 1, 14, 1]], ["tile_rc", "sp", [-1, 16]], ["tile_ry", "sp", [-1, 1]], ["tile_rx", "sp", [-1, 1]], ["auto_unroll_max_step", "ot", 1500], ["unroll_explicit", "ot", 0]]}], "r": [[2.3895107727016358e-05], 0, 75.1888120174408, 1596800324.5667431], "v": 0.1}
{"i": ["cuda -model=unknown", "topi_nn_conv2d", [["TENSOR", [1, 1024, 14, 14], "float32"], ["TENSOR", [512, 1024, 1, 1], "float32"], [1, 1], [0, 0], [1, 1], "NCHW", "float32"], {}, ["conv2d", [1, 1024, 14, 14, "float32"], [512, 1024, 1, 1, "float32"], [1, 1], [0, 0], [1, 1], "NCHW", "float32"], {"i": 3351289, "t": "direct", "c": null, "e": [["tile_f", "sp", [-1, 4, 8, 1]], ["tile_y", "sp", [-1, 2, 1, 1]], ["tile_x", "sp", [-1, 1, 14, 1]], ["tile_rc", "sp", [-1, 16]], ["tile_ry", "sp", [-1, 1]], ["tile_rx", "sp", [-1, 1]], ["auto_unroll_max_step", "ot", 1500], ["unroll_explicit", "ot", 1]]}], "r": [[5.964728591236828e-05], 0, 19.762250185012817, 1596800801.586466], "v": 0.1}
{"i": ["cuda -model=unknown", "topi_nn_conv2d", [["TENSOR", [1, 512, 14, 14], "float32"], ["TENSOR", [512, 512, 3, 3], "float32"], [2, 2], [1, 1], [1, 1], "NCHW", "float32"], {}, ["conv2d", [1, 512, 14, 14, "float32"], [512, 512, 3, 3, "float32"], [2, 2], [1, 1], [1, 1], "NCHW", "float32"], {"i": 679827, "t": "direct", "c": null, "e": [["tile_f", "sp", [-1, 1, 8, 1]], ["tile_y", "sp", [-1, 1, 7, 1]], ["tile_x", "sp", [-1, 1, 1, 1]], ["tile_rc", "sp", [-1, 8]], ["tile_ry", "sp", [-1, 3]], ["tile_rx", "sp", [-1, 3]], ["auto_unroll_max_step", "ot", 512], ["unroll_explicit", "ot", 1]]}], "r": [[0.00019533409558160505], 0, 4.6386003494262695, 1596801939.796005], "v": 0.1}
{"i": ["cuda -model=unknown", "topi_nn_conv2d", [["TENSOR", [1, 2048, 7, 7], "float32"], ["TENSOR", [512, 2048, 1, 1], "float32"], [1, 1], [0, 0], [1, 1], "NCHW", "float32"], {}, ["conv2d", [1, 2048, 7, 7, "float32"], [512, 2048, 1, 1, "float32"], [1, 1], [0, 0], [1, 1], "NCHW", "float32"], {"i": 15874, "t": "direct", "c": null, "e": [["tile_f", "sp", [-1, 1, 16, 1]], ["tile_y", "sp", [-1, 1, 1, 1]], ["tile_x", "sp", [-1, 1, 7, 1]], ["tile_rc", "sp", [-1, 16]], ["tile_ry", "sp", [-1, 1]], ["tile_rx", "sp", [-1, 1]], ["auto_unroll_max_step", "ot", 0], ["unroll_explicit", "ot", 0]]}], "r": [[7.850610669610007e-05], 0, 51.659526109695435, 1596802573.7532823], "v": 0.1}
{"i": ["cuda -model=unknown", "topi_nn_conv2d", [["TENSOR", [1, 512, 7, 7], "float32"], ["TENSOR", [512, 512, 3, 3], "float32"], [1, 1], [1, 1], [1, 1], "NCHW", "float32"], {}, ["conv2d", [1, 512, 7, 7, "float32"], [512, 512, 3, 3, "float32"], [1, 1], [1, 1], [1, 1], "NCHW", "float32"], {"i": 426665, "t": "winograd", "c": null, "e": [["tile_b", "sp", [-1, 1, 1, 1]], ["tile_y", "sp", [-1, 1, 16, 2]], ["tile_x", "sp", [-1, 1, 16, 1]], ["tile_rc", "sp", [-1, 32]], ["auto_unroll_max_step", "ot", 1500], ["unroll_explicit", "ot", 1]]}], "r": [[4.2841044038881176e-05], 0, 25.50704050064087, 1596803386.2947452], "v": 0.1}
{"i": ["cuda -model=unknown", "topi_nn_conv2d", [["TENSOR", [1, 512, 7, 7], "float32"], ["TENSOR", [2048, 512, 1, 1], "float32"], [1, 1], [0, 0], [1, 1], "NCHW", "float32"], {}, ["conv2d", [1, 512, 7, 7, "float32"], [2048, 512, 1, 1, "float32"], [1, 1], [0, 0], [1, 1], "NCHW", "float32"], {"i": 318161, "t": "direct", "c": null, "e": [["tile_f", "sp", [-1, 4, 4, 1]], ["tile_y", "sp", [-1, 1, 7, 1]], ["tile_x", "sp", [-1, 1, 7, 1]], ["tile_rc", "sp", [-1, 16]], ["tile_ry", "sp", [-1, 1]], ["tile_rx", "sp", [-1, 1]], ["auto_unroll_max_step", "ot", 1500], ["unroll_explicit", "ot", 1]]}], "r": [[3.6489659746053533e-05], 0, 86.52569246292114, 1596803942.6626635], "v": 0.1}
