TVM/tvm-log/V100/gpu/onnx/1batch/gpu_onnx_1batch_mobilenetv2_1.0.log
{"i": ["cuda -model=unknown", "topi_nn_conv2d", [["TENSOR", [1, 3, 224, 224], "float32"], ["TENSOR", [32, 3, 3, 3], "float32"], [2, 2], [1, 1], [1, 1], "NCHW", "float32"], {}, ["conv2d", [1, 3, 224, 224, "float32"], [32, 3, 3, 3, "float32"], [2, 2], [1, 1], [1, 1], "NCHW", "float32"], {"i": 15657129, "t": "direct", "c": null, "e": [["tile_f", "sp", [-1, 1, 8, 2]], ["tile_y", "sp", [-1, 2, 2, 1]], ["tile_x", "sp", [-1, 1, 16, 1]], ["tile_rc", "sp", [-1, 1]], ["tile_ry", "sp", [-1, 3]], ["tile_rx", "sp", [-1, 3]], ["auto_unroll_max_step", "ot", 512], ["unroll_explicit", "ot", 0]]}], "r": [[8.487707601594979e-06], 0, 16.017533779144287, 1596953767.4038594], "v": 0.1}
{"i": ["cuda -model=unknown", "topi_nn_conv2d", [["TENSOR", [1, 32, 112, 112], "float32"], ["TENSOR", [32, 32, 1, 1], "float32"], [1, 1], [0, 0], [1, 1], "NCHW", "float32"], {}, ["conv2d", [1, 32, 112, 112, "float32"], [32, 32, 1, 1, "float32"], [1, 1], [0, 0], [1, 1], "NCHW", "float32"], {"i": 35413924, "t": "direct", "c": null, "e": [["tile_f", "sp", [-1, 4, 2, 2]], ["tile_y", "sp", [-1, 2, 2, 1]], ["tile_x", "sp", [-1, 1, 16, 1]], ["tile_rc", "sp", [-1, 4]], ["tile_ry", "sp", [-1, 1]], ["tile_rx", "sp", [-1, 1]], ["auto_unroll_max_step", "ot", 1500], ["unroll_explicit", "ot", 1]]}], "r": [[6.912305785123967e-06], 0, 78.87736415863037, 1596954545.2840068], "v": 0.1}
{"i": ["cuda -model=unknown", "topi_nn_depthwise_conv2d_nchw", [["TENSOR", [1, 32, 112, 112], "float32"], ["TENSOR", [32, 1, 3, 3], "float32"], [1, 1], [1, 1], [1, 1], "float32"], {}, ["depthwise_conv2d_nchw", [1, 32, 112, 112, "float32"], [32, 1, 3, 3, "float32"], [1, 1], [1, 1], [1, 1], "float32"], {"i": 228523, "t": "direct", "c": null, "e": [["tile_f", "sp", [-1, 1, 4, 4]], ["tile_y", "sp", [-1, 4, 4, 1]], ["tile_x", "sp", [-1, 1, 8, 1]], ["auto_unroll_max_step", "ot", 0], ["unroll_explicit", "ot", 0]]}], "r": [[1.3370953078418664e-05], 0, 34.7357292175293, 1596954746.370434], "v": 0.1}
{"i": ["cuda -model=unknown", "topi_nn_conv2d", [["TENSOR", [1, 32, 112, 112], "float32"], ["TENSOR", [16, 32, 1, 1], "float32"], [1, 1], [0, 0], [1, 1], "NCHW", "float32"], {}, ["conv2d", [1, 32, 112, 112, "float32"], [16, 32, 1, 1, "float32"], [1, 1], [0, 0], [1, 1], "NCHW", "float32"], {"i": 11428388, "t": "direct", "c": null, "e": [["tile_f", "sp", [-1, 2, 8, 1]], ["tile_y", "sp", [-1, 1, 1, 2]], ["tile_x", "sp", [-1, 1, 28, 4]], ["tile_rc", "sp", [-1, 16]], ["tile_ry", "sp", [-1, 1]], ["tile_rx", "sp", [-1, 1]], ["auto_unroll_max_step", "ot", 1500], ["unroll_explicit", "ot", 0]]}], "r": [[1.1043008864385709e-05], 0, 6.82574200630188, 1596955194.795727], "v": 0.1}
{"i": ["cuda -model=unknown", "topi_nn_conv2d", [["TENSOR", [1, 16, 112, 112], "float32"], ["TENSOR", [96, 16, 1, 1], "float32"], [1, 1], [0, 0], [1, 1], "NCHW", "float32"], {}, ["conv2d", [1, 16, 112, 112, "float32"], [96, 16, 1, 1, "float32"], [1, 1], [0, 0], [1, 1], "NCHW", "float32"], {"i": 119703752, "t": "direct", "c": null, "e": [["tile_f", "sp", [-1, 1, 4, 6]], ["tile_y", "sp", [-1, 2, 2, 1]], ["tile_x", "sp", [-1, 1, 16, 1]], ["tile_rc", "sp", [-1, 4]], ["tile_ry", "sp", [-1, 1]], ["tile_rx", "sp", [-1, 1]], ["auto_unroll_max_step", "ot", 1500], ["unroll_explicit", "ot", 1]]}], "r": [[8.818158652790586e-06], 0, 15.775743961334229, 1596956317.9440274], "v": 0.1}
{"i": ["cuda -model=unknown", "topi_nn_depthwise_conv2d_nchw", [["TENSOR", [1, 96, 112, 112], "float32"], ["TENSOR", [96, 1, 3, 3], "float32"], [2, 2], [1, 1], [1, 1], "float32"], {}, ["depthwise_conv2d_nchw", [1, 96, 112, 112, "float32"], [96, 1, 3, 3, "float32"], [2, 2], [1, 1], [1, 1], "float32"], {"i": 7492778, "t": "direct", "c": null, "e": [["tile_f", "sp", [-1, 1, 1, 16]], ["tile_y", "sp", [-1, 2, 2, 1]], ["tile_x", "sp", [-1, 1, 7, 1]], ["auto_unroll_max_step", "ot", 1500], ["unroll_explicit", "ot", 1]]}], "r": [[2.222136522911051e-05], 0, 5.039942979812622, 1596956331.33123], "v": 0.1}
{"i": ["cuda -model=unknown", "topi_nn_conv2d", [["TENSOR", [1, 96, 56, 56], "float32"], ["TENSOR", [24, 96, 1, 1], "float32"], [1, 1], [0, 0], [1, 1], "NCHW", "float32"], {}, ["conv2d", [1, 96, 56, 56, "float32"], [24, 96, 1, 1, "float32"], [1, 1], [0, 0], [1, 1], "NCHW", "float32"], {"i": 15021484, "t": "direct", "c": null, "e": [["tile_f", "sp", [-1, 3, 4, 2]], ["tile_y", "sp", [-1, 1, 2, 1]], ["tile_x", "sp", [-1, 1, 28, 1]], ["tile_rc", "sp", [-1, 8]], ["tile_ry", "sp", [-1, 1]], ["tile_rx", "sp", [-1, 1]], ["auto_unroll_max_step", "ot", 1500], ["unroll_explicit", "ot", 0]]}], "r": [[6.443668037791632e-06], 0, 73.54746437072754, 1596956760.6469874], "v": 0.1}
{"i": ["cuda -model=unknown", "topi_nn_depthwise_conv2d_nchw", [["TENSOR", [1, 144, 56, 56], "float32"], ["TENSOR", [144, 1, 3, 3], "float32"], [1, 1], [1, 1], [1, 1], "float32"], {}, ["depthwise_conv2d_nchw", [1, 144, 56, 56, "float32"], [144, 1, 3, 3, "float32"], [1, 1], [1, 1], [1, 1], "float32"], {"i": 5182837, "t": "direct", "c": null, "e": [["tile_f", "sp", [-1, 1, 4, 1]], ["tile_y", "sp", [-1, 1, 2, 1]], ["tile_x", "sp", [-1, 2, 14, 1]], ["auto_unroll_max_step", "ot", 1500], ["unroll_explicit", "ot", 0]]}], "r": [[1.0556925340879855e-05], 0, 3.874654769897461, 1596957276.5910373], "v": 0.1}
{"i": ["cuda -model=unknown", "topi_nn_conv2d", [["TENSOR", [1, 144, 56, 56], "float32"], ["TENSOR", [24, 144, 1, 1], "float32"], [1, 1], [0, 0], [1, 1], "NCHW", "float32"], {}, ["conv2d", [1, 144, 56, 56, "float32"], [24, 144, 1, 1, "float32"], [1, 1], [0, 0], [1, 1], "NCHW", "float32"], {"i": 34957466, "t": "direct", "c": null, "e": [["tile_f", "sp", [-1, 3, 8, 1]], ["tile_y", "sp", [-1, 1, 2, 1]], ["tile_x", "sp", [-1, 1, 8, 1]], ["tile_rc", "sp", [-1, 16]], ["tile_ry", "sp", [-1, 1]], ["tile_rx", "sp", [-1, 1]], ["auto_unroll_max_step", "ot", 512], ["unroll_explicit", "ot", 1]]}], "r": [[8.451519139259696e-06], 0, 30.708630800247192, 1596957664.8231082], "v": 0.1}
{"i": ["cuda -model=unknown", "topi_nn_conv2d", [["TENSOR", [1, 24, 56, 56], "float32"], ["TENSOR", [144, 24, 1, 1], "float32"], [1, 1], [0, 0], [1, 1], "NCHW", "float32"], {}, ["conv2d", [1, 24, 56, 56, "float32"], [144, 24, 1, 1, "float32"], [1, 1], [0, 0], [1, 1], "NCHW", "float32"], {"i": 79156121, "t": "direct", "c": null, "e": [["tile_f", "sp", [-1, 3, 4, 2]], ["tile_y", "sp", [-1, 1, 1, 1]], ["tile_x", "sp", [-1, 1, 28, 1]], ["tile_rc", "sp", [-1, 4]], ["tile_ry", "sp", [-1, 1]], ["tile_rx", "sp", [-1, 1]], ["auto_unroll_max_step", "ot", 512], ["unroll_explicit", "ot", 1]]}], "r": [[7.461184174983117e-06], 0, 16.16611409187317, 1596958206.9014468], "v": 0.1}
{"i": ["cuda -model=unknown", "topi_nn_depthwise_conv2d_nchw", [["TENSOR", [1, 144, 56, 56], "float32"], ["TENSOR", [144, 1, 3, 3], "float32"], [2, 2], [1, 1], [1, 1], "float32"], {}, ["depthwise_conv2d_nchw", [1, 144, 56, 56, "float32"], [144, 1, 3, 3, "float32"], [2, 2], [1, 1], [1, 1], "float32"], {"i": 3014200, "t": "direct", "c": null, "e": [["tile_f", "sp", [-1, 1, 1, 1]], ["tile_y", "sp", [-1, 1, 7, 1]], ["tile_x", "sp", [-1, 1, 14, 1]], ["auto_unroll_max_step", "ot", 1500], ["unroll_explicit", "ot", 1]]}], "r": [[5.6281661482106e-06], 0, 10.455592393875122, 1596959346.84785], "v": 0.1}
{"i": ["cuda -model=unknown", "topi_nn_conv2d", [["TENSOR", [1, 144, 28, 28], "float32"], ["TENSOR", [32, 144, 1, 1], "float32"], [1, 1], [0, 0], [1, 1], "NCHW", "float32"], {}, ["conv2d", [1, 144, 28, 28, "float32"], [32, 144, 1, 1, "float32"], [1, 1], [0, 0], [1, 1], "NCHW", "float32"], {"i": 6126419, "t": "direct", "c": null, "e": [["tile_f", "sp", [-1, 2, 16, 1]], ["tile_y", "sp", [-1, 1, 1, 1]], ["tile_x", "sp", [-1, 1, 14, 1]], ["tile_rc", "sp", [-1, 16]], ["tile_ry", "sp", [-1, 1]], ["tile_rx", "sp", [-1, 1]], ["auto_unroll_max_step", "ot", 512], ["unroll_explicit", "ot", 1]]}], "r": [[6.112848831473146e-06], 0, 8.68746542930603, 1596959793.2020826], "v": 0.1}
{"i": ["cuda -model=unknown", "topi_nn_depthwise_conv2d_nchw", [["TENSOR", [1, 192, 28, 28], "float32"], ["TENSOR", [192, 1, 3, 3], "float32"], [1, 1], [1, 1], [1, 1], "float32"], {}, ["depthwise_conv2d_nchw", [1, 192, 28, 28, "float32"], [192, 1, 3, 3, "float32"], [1, 1], [1, 1], [1, 1], "float32"], {"i": 2386944, "t": "direct", "c": null, "e": [["tile_f", "sp", [-1, 1, 1, 1]], ["tile_y", "sp", [-1, 1, 7, 2]], ["tile_x", "sp", [-1, 1, 28, 1]], ["auto_unroll_max_step", "ot", 256], ["unroll_explicit", "ot", 1]]}], "r": [[3.750610013653042e-06], 0, 11.866441488265991, 1596961066.4843168], "v": 0.1}
{"i": ["cuda -model=unknown", "topi_nn_conv2d", [["TENSOR", [1, 192, 28, 28], "float32"], ["TENSOR", [32, 192, 1, 1], "float32"], [1, 1], [0, 0], [1, 1], "NCHW", "float32"], {}, ["conv2d", [1, 192, 28, 28, "float32"], [32, 192, 1, 1, "float32"], [1, 1], [0, 0], [1, 1], "NCHW", "float32"], {"i": 2098896, "t": "direct", "c": null, "e": [["tile_f", "sp", [-1, 2, 8, 1]], ["tile_y", "sp", [-1, 1, 1, 1]], ["tile_x", "sp", [-1, 1, 28, 1]], ["tile_rc", "sp", [-1, 32]], ["tile_ry", "sp", [-1, 1]], ["tile_rx", "sp", [-1, 1]], ["auto_unroll_max_step", "ot", 512], ["unroll_explicit", "ot", 0]]}], "r": [[6.680346745640448e-06], 0, 80.47715711593628, 1596961862.6974864], "v": 0.1}
{"i": ["cuda -model=unknown", "topi_nn_conv2d", [["TENSOR", [1, 32, 28, 28], "float32"], ["TENSOR", [192, 32, 1, 1], "float32"], [1, 1], [0, 0], [1, 1], "NCHW", "float32"], {}, ["conv2d", [1, 32, 28, 28, "float32"], [192, 32, 1, 1, "float32"], [1, 1], [0, 0], [1, 1], "NCHW", "float32"], {"i": 5066931, "t": "direct", "c": null, "e": [["tile_f", "sp", [-1, 3, 8, 1]], ["tile_y", "sp", [-1, 1, 1, 1]], ["tile_x", "sp", [-1, 1, 28, 1]], ["tile_rc", "sp", [-1, 8]], ["tile_ry", "sp", [-1, 1]], ["tile_rx", "sp", [-1, 1]], ["auto_unroll_max_step", "ot", 512], ["unroll_explicit", "ot", 0]]}], "r": [[4.522772749497474e-06], 0, 3.960932731628418, 1596962800.6052868], "v": 0.1}
{"i": ["cuda -model=unknown", "topi_nn_depthwise_conv2d_nchw", [["TENSOR", [1, 192, 28, 28], "float32"], ["TENSOR", [192, 1, 3, 3], "float32"], [2, 2], [1, 1], [1, 1], "float32"], {}, ["depthwise_conv2d_nchw", [1, 192, 28, 28, "float32"], [192, 1, 3, 3, "float32"], [2, 2], [1, 1], [1, 1], "float32"], {"i": 475776, "t": "direct", "c": null, "e": [["tile_f", "sp", [-1, 1, 1, 1]], ["tile_y", "sp", [-1, 1, 14, 1]], ["tile_x", "sp", [-1, 1, 14, 1]], ["auto_unroll_max_step", "ot", 1500], ["unroll_explicit", "ot", 1]]}], "r": [[3.808248422588532e-06], 0, 11.869761943817139, 1596963134.6983168], "v": 0.1}
{"i": ["cuda -model=unknown", "topi_nn_conv2d", [["TENSOR", [1, 192, 14, 14], "float32"], ["TENSOR", [64, 192, 1, 1], "float32"], [1, 1], [0, 0], [1, 1], "NCHW", "float32"], {}, ["conv2d", [1, 192, 14, 14, "float32"], [64, 192, 1, 1, "float32"], [1, 1], [0, 0], [1, 1], "NCHW", "float32"], {"i": 483862, "t": "direct", "c": null, "e": [["tile_f", "sp", [-1, 1, 16, 1]], ["tile_y", "sp", [-1, 1, 1, 1]], ["tile_x", "sp", [-1, 1, 14, 1]], ["tile_rc", "sp", [-1, 24]], ["tile_ry", "sp", [-1, 1]], ["tile_rx", "sp", [-1, 1]], ["auto_unroll_max_step", "ot", 512], ["unroll_explicit", "ot", 0]]}], "r": [[5.124212620063336e-06], 0, 43.98641633987427, 1596963861.8752434], "v": 0.1}
{"i": ["cuda -model=unknown", "topi_nn_conv2d", [["TENSOR", [1, 384, 14, 14], "float32"], ["TENSOR", [64, 384, 1, 1], "float32"], [1, 1], [0, 0], [1, 1], "NCHW", "float32"], {}, ["conv2d", [1, 384, 14, 14, "float32"], [64, 384, 1, 1, "float32"], [1, 1], [0, 0], [1, 1], "NCHW", "float32"], {"i": 870934, "t": "direct", "c": null, "e": [["tile_f", "sp", [-1, 1, 16, 1]], ["tile_y", "sp", [-1, 1, 1, 1]], ["tile_x", "sp", [-1, 1, 14, 1]], ["tile_rc", "sp", [-1, 24]], ["tile_ry", "sp", [-1, 1]], ["tile_rx", "sp", [-1, 1]], ["auto_unroll_max_step", "ot", 1500], ["unroll_explicit", "ot", 0]]}], "r": [[7.98386339670874e-06], 0, 8.230140447616577, 1596965290.0987809], "v": 0.1}
{"i": ["cuda -model=unknown", "topi_nn_conv2d", [["TENSOR", [1, 64, 14, 14], "float32"], ["TENSOR", [384, 64, 1, 1], "float32"], [1, 1], [0, 0], [1, 1], "NCHW", "float32"], {}, ["conv2d", [1, 64, 14, 14, "float32"], [384, 64, 1, 1, "float32"], [1, 1], [0, 0], [1, 1], "NCHW", "float32"], {"i": 1415099, "t": "direct", "c": null, "e": [["tile_f", "sp", [-1, 3, 8, 1]], ["tile_y", "sp", [-1, 1, 2, 1]], ["tile_x", "sp", [-1, 1, 14, 1]], ["tile_rc", "sp", [-1, 16]], ["tile_ry", "sp", [-1, 1]], ["tile_rx", "sp", [-1, 1]], ["auto_unroll_max_step", "ot", 512], ["unroll_explicit", "ot", 0]]}], "r": [[5.158840817290038e-06], 0, 2.595139741897583, 1596965377.7756517], "v": 0.1}
{"i": ["cuda -model=unknown", "topi_nn_depthwise_conv2d_nchw", [["TENSOR", [1, 384, 14, 14], "float32"], ["TENSOR", [384, 1, 3, 3], "float32"], [1, 1], [1, 1], [1, 1], "float32"], {}, ["depthwise_conv2d_nchw", [1, 384, 14, 14, "float32"], [384, 1, 3, 3, "float32"], [1, 1], [1, 1], [1, 1], "float32"], {"i": 556320, "t": "direct", "c": null, "e": [["tile_f", "sp", [-1, 1, 1, 1]], ["tile_y", "sp", [-1, 2, 7, 1]], ["tile_x", "sp", [-1, 1, 14, 1]], ["auto_unroll_max_step", "ot", 256], ["unroll_explicit", "ot", 1]]}], "r": [[3.4893022834569803e-06], 0, 7.812001943588257, 1596966129.6257136], "v": 0.1}
{"i": ["cuda -model=unknown", "topi_nn_conv2d", [["TENSOR", [1, 384, 14, 14], "float32"], ["TENSOR", [96, 384, 1, 1], "float32"], [1, 1], [0, 0], [1, 1], "NCHW", "float32"], {}, ["conv2d", [1, 384, 14, 14, "float32"], [96, 384, 1, 1, "float32"], [1, 1], [0, 0], [1, 1], "NCHW", "float32"], {"i": 1519671, "t": "direct", "c": null, "e": [["tile_f", "sp", [-1, 1, 24, 1]], ["tile_y", "sp", [-1, 1, 1, 1]], ["tile_x", "sp", [-1, 1, 14, 1]], ["tile_rc", "sp", [-1, 48]], ["tile_ry", "sp", [-1, 1]], ["tile_rx", "sp", [-1, 1]], ["auto_unroll_max_step", "ot", 512], ["unroll_explicit", "ot", 0]]}], "r": [[1.0439824753896637e-05], 0, 70.22207021713257, 1596966749.1275604], "v": 0.1}
{"i": ["cuda -model=unknown", "topi_nn_depthwise_conv2d_nchw", [["TENSOR", [1, 576, 14, 14], "float32"], ["TENSOR", [576, 1, 3, 3], "float32"], [1, 1], [1, 1], [1, 1], "float32"], {}, ["depthwise_conv2d_nchw", [1, 576, 14, 14, "float32"], [576, 1, 3, 3, "float32"], [1, 1], [1, 1], [1, 1], "float32"], {"i": 1014741, "t": "direct", "c": null, "e": [["tile_f", "sp", [-1, 1, 2, 1]], ["tile_y", "sp", [-1, 1, 14, 1]], ["tile_x", "sp", [-1, 1, 7, 2]], ["auto_unroll_max_step", "ot", 256], ["unroll_explicit", "ot", 1]]}], "r": [[3.743510910815939e-06], 0, 7.730690240859985, 1596967582.8296862], "v": 0.1}
{"i": ["cuda -model=unknown", "topi_nn_conv2d", [["TENSOR", [1, 576, 14, 14], "float32"], ["TENSOR", [96, 576, 1, 1], "float32"], [1, 1], [0, 0], [1, 1], "NCHW", "float32"], {}, ["conv2d", [1, 576, 14, 14, "float32"], [96, 576, 1, 1, "float32"], [1, 1], [0, 0], [1, 1], "NCHW", "float32"], {"i": 6795312, "t": "direct", "c": null, "e": [["tile_f", "sp", [-1, 2, 12, 1]], ["tile_y", "sp", [-1, 1, 1, 1]], ["tile_x", "sp", [-1, 1, 14, 1]], ["tile_rc", "sp", [-1, 48]], ["tile_ry", "sp", [-1, 1]], ["tile_rx", "sp", [-1, 1]], ["auto_unroll_max_step", "ot", 1500], ["unroll_explicit", "ot", 1]]}], "r": [[1.3588420983692448e-05], 0, 100.6354238986969, 1596968092.4806342], "v": 0.1}
{"i": ["cuda -model=unknown", "topi_nn_conv2d", [["TENSOR", [1, 96, 14, 14], "float32"], ["TENSOR", [576, 96, 1, 1], "float32"], [1, 1], [0, 0], [1, 1], "NCHW", "float32"], {}, ["conv2d", [1, 96, 14, 14, "float32"], [576, 96, 1, 1, "float32"], [1, 1], [0, 0], [1, 1], "NCHW", "float32"], {"i": 4194230, "t": "direct", "c": null, "e": [["tile_f", "sp", [-1, 2, 16, 1]], ["tile_y", "sp", [-1, 2, 1, 1]], ["tile_x", "sp", [-1, 1, 14, 1]], ["tile_rc", "sp", [-1, 16]], ["tile_ry", "sp", [-1, 1]], ["tile_rx", "sp", [-1, 1]], ["auto_unroll_max_step", "ot", 512], ["unroll_explicit", "ot", 0]]}], "r": [[7.953301495341737e-06], 0, 15.955402612686157, 1596969456.511291], "v": 0.1}
{"i": ["cuda -model=unknown", "topi_nn_depthwise_conv2d_nchw", [["TENSOR", [1, 576, 14, 14], "float32"], ["TENSOR", [576, 1, 3, 3], "float32"], [2, 2], [1, 1], [1, 1], "float32"], {}, ["depthwise_conv2d_nchw", [1, 576, 14, 14, "float32"], [576, 1, 3, 3, "float32"], [2, 2], [1, 1], [1, 1], "float32"], {"i": 1721, "t": "direct", "c": null, "e": [["tile_f", "sp", [-1, 3, 3, 1]], ["tile_y", "sp", [-1, 1, 7, 1]], ["tile_x", "sp", [-1, 1, 1, 1]], ["auto_unroll_max_step", "ot", 0], ["unroll_explicit", "ot", 0]]}], "r": [[8.739373263739108e-06], 0, 11.83099913597107, 1596969515.8213868], "v": 0.1}
{"i": ["cuda -model=unknown", "topi_nn_conv2d", [["TENSOR", [1, 576, 7, 7], "float32"], ["TENSOR", [160, 576, 1, 1], "float32"], [1, 1], [0, 0], [1, 1], "NCHW", "float32"], {}, ["conv2d", [1, 576, 7, 7, "float32"], [160, 576, 1, 1, "float32"], [1, 1], [0, 0], [1, 1], "NCHW", "float32"], {"i": 424751, "t": "direct", "c": null, "e": [["tile_f", "sp", [-1, 1, 16, 1]], ["tile_y", "sp", [-1, 1, 1, 1]], ["tile_x", "sp", [-1, 1, 7, 1]], ["tile_rc", "sp", [-1, 48]], ["tile_ry", "sp", [-1, 1]], ["tile_rx", "sp", [-1, 1]], ["auto_unroll_max_step", "ot", 1500], ["unroll_explicit", "ot", 1]]}], "r": [[1.209848449997081e-05], 0, 65.47418284416199, 1596970481.2432804], "v": 0.1}
{"i": ["cuda -model=unknown", "topi_nn_conv2d", [["TENSOR", [1, 960, 7, 7], "float32"], ["TENSOR", [160, 960, 1, 1], "float32"], [1, 1], [0, 0], [1, 1], "NCHW", "float32"], {}, ["conv2d", [1, 960, 7, 7, "float32"], [160, 960, 1, 1, "float32"], [1, 1], [0, 0], [1, 1], "NCHW", "float32"], {"i": 256292, "t": "direct", "c": null, "e": [["tile_f", "sp", [-1, 1, 8, 1]], ["tile_y", "sp", [-1, 1, 1, 1]], ["tile_x", "sp", [-1, 1, 7, 1]], ["tile_rc", "sp", [-1, 40]], ["tile_ry", "sp", [-1, 1]], ["tile_rx", "sp", [-1, 1]], ["auto_unroll_max_step", "ot", 1500], ["unroll_explicit", "ot", 0]]}], "r": [[1.786443810895535e-05], 0, 5.004583835601807, 1596971235.7267883], "v": 0.1}
{"i": ["cuda -model=unknown", "topi_nn_conv2d", [["TENSOR", [1, 160, 7, 7], "float32"], ["TENSOR", [960, 160, 1, 1], "float32"], [1, 1], [0, 0], [1, 1], "NCHW", "float32"], {}, ["conv2d", [1, 160, 7, 7, "float32"], [960, 160, 1, 1, "float32"], [1, 1], [0, 0], [1, 1], "NCHW", "float32"], {"i": 680152, "t": "direct", "c": null, "e": [["tile_f", "sp", [-1, 3, 5, 1]], ["tile_y", "sp", [-1, 1, 7, 1]], ["tile_x", "sp", [-1, 1, 7, 1]], ["tile_rc", "sp", [-1, 20]], ["tile_ry", "sp", [-1, 1]], ["tile_rx", "sp", [-1, 1]], ["auto_unroll_max_step", "ot", 1500], ["unroll_explicit", "ot", 0]]}], "r": [[9.572245043093299e-06], 0, 88.80132961273193, 1596971685.5904129], "v": 0.1}
{"i": ["cuda -model=unknown", "topi_nn_depthwise_conv2d_nchw", [["TENSOR", [1, 960, 7, 7], "float32"], ["TENSOR", [960, 1, 3, 3], "float32"], [1, 1], [1, 1], [1, 1], "float32"], {}, ["depthwise_conv2d_nchw", [1, 960, 7, 7, "float32"], [960, 1, 3, 3, "float32"], [1, 1], [1, 1], [1, 1], "float32"], {"i": 78004, "t": "direct", "c": null, "e": [["tile_f", "sp", [-1, 1, 3, 1]], ["tile_y", "sp", [-1, 1, 7, 1]], ["tile_x", "sp", [-1, 1, 7, 1]], ["auto_unroll_max_step", "ot", 0], ["unroll_explicit", "ot", 1]]}], "r": [[3.3526544047511923e-06], 0, 40.23443126678467, 1596972361.917141], "v": 0.1}
{"i": ["cuda -model=unknown", "topi_nn_conv2d", [["TENSOR", [1, 960, 7, 7], "float32"], ["TENSOR", [320, 960, 1, 1], "float32"], [1, 1], [0, 0], [1, 1], "NCHW", "float32"], {}, ["conv2d", [1, 960, 7, 7, "float32"], [320, 960, 1, 1, "float32"], [1, 1], [0, 0], [1, 1], "NCHW", "float32"], {"i": 373689, "t": "direct", "c": null, "e": [["tile_f", "sp", [-1, 1, 16, 1]], ["tile_y", "sp", [-1, 1, 1, 1]], ["tile_x", "sp", [-1, 1, 7, 1]], ["tile_rc", "sp", [-1, 30]], ["tile_ry", "sp", [-1, 1]], ["tile_rx", "sp", [-1, 1]], ["auto_unroll_max_step", "ot", 1500], ["unroll_explicit", "ot", 0]]}], "r": [[2.446008644832774e-05], 0, 37.67584419250488, 1596973049.0349658], "v": 0.1}
{"i": ["cuda -model=unknown", "topi_nn_conv2d", [["TENSOR", [1, 320, 7, 7], "float32"], ["TENSOR", [1280, 320, 1, 1], "float32"], [1, 1], [0, 0], [1, 1], "NCHW", "float32"], {}, ["conv2d", [1, 320, 7, 7, "float32"], [1280, 320, 1, 1, "float32"], [1, 1], [0, 0], [1, 1], "NCHW", "float32"], {"i": 691782, "t": "direct", "c": null, "e": [["tile_f", "sp", [-1, 1, 40, 1]], ["tile_y", "sp", [-1, 1, 1, 1]], ["tile_x", "sp", [-1, 1, 7, 1]], ["tile_rc", "sp", [-1, 40]], ["tile_ry", "sp", [-1, 1]], ["tile_rx", "sp", [-1, 1]], ["auto_unroll_max_step", "ot", 512], ["unroll_explicit", "ot", 1]]}], "r": [[2.5281648177114667e-05], 0, 80.82081913948059, 1596974035.9768655], "v": 0.1}
{"i": ["cuda -model=unknown", "topi_nn_conv2d", [["TENSOR", [1, 1280, 1, 1], "float32"], ["TENSOR", [1000, 1280, 1, 1], "float32"], [1, 1], [0, 0], [1, 1], "NCHW", "float32"], {}, ["conv2d", [1, 1280, 1, 1, "float32"], [1000, 1280, 1, 1, "float32"], [1, 1], [0, 0], [1, 1], "NCHW", "float32"], {"i": 33236, "t": "direct", "c": null, "e": [["tile_f", "sp", [-1, 1, 5, 1]], ["tile_y", "sp", [-1, 1, 1, 1]], ["tile_x", "sp", [-1, 1, 1, 1]], ["tile_rc", "sp", [-1, 80]], ["tile_ry", "sp", [-1, 1]], ["tile_rx", "sp", [-1, 1]], ["auto_unroll_max_step", "ot", 512], ["unroll_explicit", "ot", 1]]}], "r": [[3.0466833117723154e-05], 0, 16.076761484146118, 1596975199.7073932], "v": 0.1}
